comment_id,body,rating
UgwYQEU4YgnDAn910pV4AaABAg,clown news network what bufon at clown news network have falen to own by presid daili basi not quit while behind way behind rerun simpson beat rate contemporari laugh at you we al laugh at you fuck fake news clown news network,0
Ugx980i1Bh_vGuJeShV4AaABAg,fake had flag as mislead text,0
Ugyah108nUT5S4Bi1j14AaABAg,oh cn yet anoth fake video where make up what hapen,0
UgyDotlUJwfDmCEY5x54AaABAg,cn shithol news,0
UgzoWRmzmMPTylYIQft4AaABAg,do quick research web youl se how fake cn,0
Ugwj_wRDFwdA9gYB-BR4AaABAg,veri fake news lmfao stori german tv alreadi admit amplifi laugh suck msm sad fake bust again,0
UgzinaOxlv_jGe-7z3Z4AaABAg,thumb up thumb down ratio say al cn tabloid,0
UgzYknKrl-xb1jQpcdB4AaABAg,cnuse likewatch al time nowi onli find news post type smhcn disgrac,0
Ugz5q35VHt9yPqWJxCd4AaABAg,fake news we se through especiali cn,0
UgwiLc3IztxvqZGB7b14AaABAg,were bo cn your fuck stupid not even tel laughh,0
UgzXbqwuNN0U9ntowMJ4AaABAg,cn wil never shed their fake news label if they kep do stuf like this,0
UgyulLf66YSoSkHEV4F4AaABAg,cn fake news,0
UgzwX8aXwoAHO7IYXv14AaABAg,they clape even youtub chanel fake trash,0
UgwqrXuGy0i28Odya7Z4AaABAg,they bo becaus said camera would go of cn dumb,0
Ugw3nM_qJApP3kspoCN4AaABAg,fuck click bait turdcn,0
UgxBgydMhWfrAKv2jDd4AaABAg,heard faint groan fake news,0
UgzzEZaa0-LCa7VLwWt4AaABAg,lok man hate trump nobodi there bo him cn dumb as shit,0
UgzMOjCJEy6xrXqN30B4AaABAg,there no bo there onli laughter clape,0
UgxmhzB72sRK6cqbrXJ4AaABAg,should piec shit trump,0
UgyOIVU2fqJQXj--0st4AaABAg,laugh cn eat dick fake news,0
Ugxr7KcmznuK4gE2GbF4AaABAg,wel fakei mean vid not trump,0
UgyOKYowYElNi2EBPKp4AaABAg,wow like peopl bo do not like trump cn ned chil,0
UgyLpsqzAzBSIRPlv1B4AaABAg,k dislik screw of cn,0
UgyvBQkKvm1MkGo_1UJ4AaABAg,wish donald trump fake,0
Ugz6wmzfvKm_vakYebB4AaABAg,cn fake news,0
Ugx1X3g5y_-hvB9G6ON4AaABAg,laugh how stupid can cn get obv not bo laugh fake as fuck news liber scum,0
UgwMmIgRaDz9EsZzARV4AaABAg,fake one as fake as psycho liar can be no not do great job onli fantasi,0
UgzNQfnCX_uAQLXfIup4AaABAg,what bos ya fuckin prick lmao,0
UgwfXGxxg4ovJtcQW1J4AaABAg,they said o quit spread lie,0
UgxaABUEtNmFIcZLbYd4AaABAg,weakest bo ever,0
Ugz5K3Qcoj50ddm4Pjd4AaABAg,would hard cal bo idiot,0
UgyO9u-exjgX_PsWdWR4AaABAg,fuck trump am right,0
Ugx0s2-FgBFnCjne65J4AaABAg,go bed fake news,0
UgyJ0YEaUpMolgcQaSp4AaABAg,they bo fake media back rom nice tri cn fail,0
Ugw3yqVLHg0PSJnSSJN4AaABAg,like ratio speak dumb video,0
UgzBYTo1ychqyZmhhoN4AaABAg,sigh it like their tri prove theyr fake,0
UgxnVc6sSBQPVDfbie54AaABAg,cn kil yourselv,0
UgxhOJuJurVNbcSOiYp4AaABAg,that becaus fake news presid go figur mr briliant,0
UgyUDEYlYzthMiP_lwJ4AaABAg,cn fake news video fake case close,0
UgwHJImMhvrzRmEtdKl4AaABAg,heard hard ani bos at al,0
UgxzsmslP43SKu-9WB14AaABAg,it funi caus titl fake news,0
Ugxo3jhCBi8Ti__ZEaR4AaABAg,bo heard meant shiti pres like cn trump stil pule string,0
UgyVA0tMdADZ2VWscmF4AaABAg,cn as,0
UgzK5Upy_7i_KobyWmN4AaABAg,o not bo fake news confirm again,0
Ugz4TWhz3wJ5_ft1_Al4AaABAg,fuck cn,0
UgyJyHbwcymGJg2ranF4AaABAg,fake news it cn,0
UgyIFsw7y46jqZ-w7Th4AaABAg,noth lol cn fake,0
Ugxzb4VOuuHljhKS2614AaABAg,republican worthl cocksuck ruin america,0
UgwXPLJ7tsqkKVSM4P14AaABAg,imagin have pay steam,0
Ugy7UPhfWt0CpxyAa054AaABAg,whoever like this fuck you,0
UgzI0CrsKnap2cOVnZ54AaABAg,wow gredi polit win again,0
UgxogdwADzDNC9XvkRR4AaABAg,fucker,0
UgxhPWbvrg-oq1HDCO14AaABAg,godby internet,0
UgzmxkHYisZ6puPXB9h4AaABAg,wel we fuck with internet now,0
Ugy7WSS1SQQEiyO7S3l4AaABAg,should cale the fc be it piec shit self again,0
UgyAiRP5UAshRJxa5Nt4AaABAg,when fc made bigest mistak it exist,0
UgxNHCpwooYcIOO35Xp4AaABAg,unelect peopl chose futur internet peopl not want,0
UgzOltObf2S5jOWqslZ4AaABAg,finger crose someon from dep web get ahold guy laugh,0
UgydgV6fOJql1JE9Bu14AaABAg,hate delay voic it kile jesus,0
Ugx7sWXPwkuMO7H52w14AaABAg,im gona mark down as no veri disrespect,0
UgyOmCShkzGPSqRI-xF4AaABAg,wow trump fuck up america again jesus christ,0
UgzI7cixFFiiDK8YsEp4AaABAg,dislik laugh god,0
Ugy9KShfYunmXc7ves94AaABAg,what america is lete few peopl vote someth instead lete america democraticali vote it,0
UgzUfP5w8ijjgiJt_OZ4AaABAg,typic fuck up america laugh,0
Ugw2wOw4d8om4nCWjUV4AaABAg,fuck fc,0
UgzPoyMZ0NC1liap-BN4AaABAg,amount dislik speak itself we peopl do not want net netur repeal,0
UgxKDVqyJG9TMZJGntt4AaABAg,truli hope they al go fuck themselv now fuck hope they crash their car lose limb fuck these guy,0
UgwksbCg7imiFLNcHS54AaABAg,fuck bulshit turn percent american into peopl who want basicali kil kim jong un beter nuke america bulshit,0
UgwF1RluMcRgC3jvSN94AaABAg,freak fc,0
Ugw0drq_M1Lj5bzjUsV4AaABAg,fuck bitch,0
Ugzg96n3jc_lL4PFyit4AaABAg,fuck trump his dumb as staf,0
Ugw7u8VpDqkx7NrS4sd4AaABAg,screw ajit,0
UgznW7546wFDz-AecW54AaABAg,no more meme to,0
Ugwrx6U3KP5EjisEqBZ4AaABAg,cant have more dislik peopl,0
UgysZG-0Ae5x81tDO-t4AaABAg,who tf like video verizon employ or at tryna slick dumb bitch,0
UgxReGjfHsDkm3jf6814AaABAg,fuck shit fuck,0
UgzV2m-1hF7dgJpP1tx4AaABAg,sincer hope ajit pai ses this fuck you,0
UgyQxP9aQj8CLi6-Y654AaABAg,thank caus great depres,0
UgwnZxQny-B5uc3C23Z4AaABAg,fuck comunist,0
UgzFiTEcPVS_Jo_Az2F4AaABAg,rude how dare take away our fre internet,0
Ugz-g2bkJNtCvaHoGm94AaABAg,gred at it finest,0
Ugxr5QoXD14cspAyUoV4AaABAg,it ofici internet fed,0
Ugw-dO7uDwrCrILQKol4AaABAg,fuck you,0
UgxE7cimY4GRH7jGFJx4AaABAg,fuck ajit pat fuck brendan car fuck michel ori not how democraci work,0
UgxeU3hmFfMLUR2np214AaABAg,man some bulshit,0
Ugw2CXDQHgm40A2rkRV4AaABAg,one most corupt move american histori,0
UgwNrP_pNKLRTpKPt5J4AaABAg,omg she think shes jesica rabit how aw,0
Ugw4JnUmpyDDxlIgHCt4AaABAg,disgrac countri,0
UgwjbuClxuV97HRcf1N4AaABAg,ear hurt,0
Ugzg9prj3HD88L25FkR4AaABAg,omg sound as if someon put distort efect her,0
UgyTvzCrP3AAQlUJnEZ4AaABAg,hurt mani level aint even american,0
UgzIZh4Bm2MEDXZHL1h4AaABAg,wowtf,0
UgyOf2cshwRUxzi8MEt4AaABAg,jez real she ruin it,0
UgyxxPOFwMPmsq5tRh14AaABAg,laugh horibl,0
UgxhxTlgADez4jMEaR14AaABAg,they ruin star spangl baner,0
UgzKDpXSWep-14TFde54AaABAg,wtf direct from whitney anthem horifi,0
UgziVYOK0crATGMXTV54AaABAg,tortur,0
UgxNcGO4GhJaEx-9Rf54AaABAg,what kind shit this mariah pleas teach fergi how sing,0
UgzEQFni8DnnafgBWYV4AaABAg,yuck damn shes teribl let never reliv moment,0
Ugx-EZmybfXK0LQeSW54AaABAg,swear saw selena gomez coment she cant sing,0
UgyKNhSZzwNUd2t0W7N4AaABAg,oh no think cat got run over driveway oh wait never mind video,0
UgytYTmDrnG1oGDprNp4AaABAg,hate when peopl remix nation anthem make sound quer,0
UgwT9RLU6fy-0mWNzRl4AaABAg,wtf this im scare,0
UgxgGwDN8rwVJ0YkEsp4AaABAg,first half preti fine al went shit after,0
Ugxqy_DkUGRSGJgiXEJ4AaABAg,im canadian fel bad,0
Ugx1ki156ZtJj9TBqgp4AaABAg,fergi let play some basketb me let play some auto tune,0
UgziRzAD2SuQmqIIOUx4AaABAg,as cringey as i play pokémon go everyday song,0
Ugy9Um3gteRDZkqANEZ4AaABAg,back track disast literali sound like morn dump soundtrack,0
Ugw1kancPWHaXcZch354AaABAg,argh she sound like squeaki dor im over,0
Ugxp6AVeJDRBV6H3-od4AaABAg,weli gue not everyon can sing star spangl baner,0
UgxHb34GBM-K1AmUajV4AaABAg,threw up,0
UgzrEG7XTEhE0KfIEdZ4AaABAg,omg bet draymon sing beter than her,0
UgxT8W01UQi92jtjLrt4AaABAg,hard watch omg im cring through whole perform,0
UgyCTcEbHD2x9y_k5BR4AaABAg,wowembaras,0
UgwP7S16Ww7tdigHpCB4AaABAg,shes disgrac our countri,0
Ugx-cM7qzjlL-RtEUf54AaABAg,what actual fuck did watch,0
UgyPTp1l_mvDbkygZwl4AaABAg,that bad hurt,0
Ugy60Eog99vYFZSmYsp4AaABAg,she hwing disrespect flag,0
UgyOxwZsm30DlmV6moh4AaABAg,everi time time listen think what fuck mosli becaus she think it god,0
UgxFiEAtT1z1DosSQWx4AaABAg,th s c nc e,0
UgxAGPvfJYkTSg2QBhl4AaABAg,where gun when ned,0
UgwotOTtrk5X2VVVPYp4AaABAg,ned clean ear now laugh,0
UgxP5NbMOM5iK8kE5El4AaABAg,bad,0
Ugwa-k4uMiG-IrNEV8F4AaABAg,bruh listen live think crazi laugh until saw curi laugh,0
UgyaJx1eN7wr-nu81RJ4AaABAg,she sound like die cat laugh,0
UgyP2ThaRmV1kfv9Nup4AaABAg,shes sing like shes rundown nightclub bo,0
UgyACfo1H2RiohmDXjt4AaABAg,jesus,0
UgwPkGQvblLThhLZryd4AaABAg,got cancer from hear,0
Ugxzf4buH4D-T9mbvix4AaABAg,bitch meth,0
UgwCW4DeIvLmb2iu53J4AaABAg,ive heard cat fight sound beter than this,0
Ugzwm3R3Yoms1TVM6CN4AaABAg,shes like drunk,0
Ugzp1n_f2yIAQTgz88x4AaABAg,it remind how us weak,0
Ugz7a3cZarigYlRrSkd4AaABAg,certain losen crowd up with laughter,0
UgwLuPjHdI_kgA0tcPt4AaABAg,she cant sing,0
UgyjY1l07GagH3dY1d54AaABAg,ariana grand at year old sound beter,0
UgxDNIWcxIGmScLn4jR4AaABAg,what hapen her voic,0
UgyYYybYo72j1PpK6vZ4AaABAg,what shit,0
Ugwk4tSXwoB-5RT5Ii14AaABAg,she must ben drug day,0
Ugy75sN3MNcA6ILM4vF4AaABAg,what fuck wasthat,0
Ugz5s9h_h1wCdAxPDnp4AaABAg,should do homework no im here listen meme song,0
UgyexmvpnEt883SwYSR4AaABAg,day she said god bye her carer,0
Ugx6oPyTUQ86hSYzUDp4AaABAg,omg ouch ear even player want laugh,0
Ugy7rxT4TOLiLHdrx7h4AaABAg,gald out ofic,0
Ugwvw66BfT1CsgjT0VR4AaABAg,eye ear,0
UgxkK_8NHv-WHQyIf0x4AaABAg,fuck,0
UgynKo5mbcvZsUVcxUB4AaABAg,even dude famili hate him,0
Ugx6R6XHZBxnGmH1nCR4AaABAg,fuck,0
Ugzxzb_RjCp_Qa3rdCB4AaABAg,hope stupid rese cup break moron,0
UgxyEYAC6xBJF6_2VWB4AaABAg,most pain video have ever sen,0
Ugz0zm3oe0_vp_xkdHB4AaABAg,what tol,0
UgxN7oWN4fYujp8yQJN4AaABAg,get inoc dog away from him,0
Ugyfh7uBvzzmuIb4kXp4AaABAg,epitom how do do felow kid,0
UgywXmarzn8QHrmmr0R4AaABAg,when both republican democrat realiz shit retard,0
UgzUnFpNwdd8SrOTDSp4AaABAg,am revisit sht,0
UgwnvdqO0duOYhFtom94AaABAg,not like fc becaus video,0
UgycHOu51p6A7T9xfbB4AaABAg,has one soriest video youtub,0
UgxV_h_rYkZzLGwnQtF4AaABAg,jesú christ what mes,0
UgzYyThcr49LlLItTpx4AaABAg,lok like fuck turd,0
UgyvW-XmhNFl8SJdyMJ4AaABAg,im stil mad about,0
UgzNw3DOk814_ik9NDV4AaABAg,who hel like,0
UgxOV5lUNL8NsB5QQ2N4AaABAg,sec watch im wile pay anyth if mean can punch douchebag,0
UgynnSbNjLqo3n8H-2p4AaABAg,has worst video histori video sinc mayb ever,0
UgwbzPjEOuisaISNz4t4AaABAg,make not want eat at chipotl,0
Ugxm8J7uyPWpSUhl_J14AaABAg,lok at ugli fuck rd world face,0
UgyQ4w2EHVz9K5yGoWl4AaABAg,what jacka holi shit,0
UgwRiLT40AwxdQT7hxd4AaABAg,pajet po lo back third world shite stret america american,0
UgxHPm1Sz-MOx47kWKR4AaABAg,dislik buton get rape,0
UgxBdm-CuN-4kOL6RzN4AaABAg,so ridicul cringey,0
UgxENXgmqZ3VusSzKzl4AaABAg,im watch onli like becaus how cringi,0
UgwOOlVVqXjQ4TiJAm54AaABAg,kil right now,0
UgxbpJ0d34IwtKbPBeZ4AaABAg,hey can we get video milion dislik pleas,0
UgyrOddkzaNahzKXEeN4AaABAg,fucker tring hard funi,0
UgxFTFGyUU0-9K2Q1hl4AaABAg,stop pretend human ajit,0
Ugx5wsf0e-7EQ8xEqux4AaABAg,legit fuck cri,0
UgxV4KJ25GOJIlvKBjh4AaABAg,ajit pai more like shit guy,0
UgyL8j9LOaWGiP6z3qB4AaABAg,at least agr it reali stupid,0
UgwzMjyECw0Oencp6r14AaABAg,ha get fuck smoke,0
UgxJUazFje6Jx_pXvJp4AaABAg,go rfelowkid,0
Ugx65xSFwKbpRZMzztB4AaABAg,like corupt politician,0
UgxXZM6d-_Zt4bjE-Wp4AaABAg,who like first place,0
UgxoG7GtzPL3NdyQy1x4AaABAg,must joke right cant stop laugh,0
UgxngsTXdi_5TncKT154AaABAg,thank gredi scumbag,0
UgwnKUz9kCBNFW61pW14AaABAg,shit pie worst pile shit has face no one can love,0
UgxhOE3oRUvusgnuY694AaABAg,martina bitch one main peopl who help push pizag conspiraci,0
UgwCSgfvm0oJatFDYfF4AaABAg,meme can we ruin,0
UgysG1IAPhFEq4gzu014AaABAg,what douch,0
UgzwqOHGysKLkPefRvJ4AaABAg,have never came acro someon with such punchabl face as him,0
UgwpSx23DnC-Hj7wY3d4AaABAg,suck,0
Ugw5ISnH2rX2srIK-vd4AaABAg,fuck did peopl like video have they no saniti,0
UgyYEwnWSfYYCevmuW94AaABAg,im here dislik d,0
UgwWl_40E1vl2z0eoZp4AaABAg,wtf,0
Ugxpd5JFZGqVSJYKtjl4AaABAg,when thought not hate shit pie mean ajit pai anymor,0
Ugy2FY-j8s8QXFMbNe14AaABAg,son bitch,0
UgybwwY9X-q0XqFPgl94AaABAg,strait fuck guy pancrea,0
UgxFRKqA-8KxIWhH5FN4AaABAg,know man fuck idiot,0
UgxxA4zAtaPs6ANRtwd4AaABAg,go hel take cheap suit with,0
Ugxl8Ym23OlZIgf_xmR4AaABAg,not wori hel burn hel angri bad,0
Ugyn7h2gf3rFvVH2kL14AaABAg,clip alon embodi how do do felow kid fuck hate,0
UgwrRv0Sw0Agn6lnVLZ4AaABAg,prof alien have invad earth also fuck you we ned god internet it shit,0
UgyiOqaMwCFHlQouAnV4AaABAg,tri hard relev,0
Ugy4VayLXpkf4HeD_BB4AaABAg,if video were age restrict there not ani like,0
UgxBpeVod0_h81necyh4AaABAg,im sori got anual fcked,0
UgyOsqJQce6OQMcpFnV4AaABAg,k dislik make milion alreadi,0
UgzqIQ1kLXN6p26yib94AaABAg,wow shit,0
Ugz-a9F73VbjQdtAlz54AaABAg,cring,0
Ugycl9SaSw1eiwJjrYh4AaABAg,stil litl bit h,0
Ugw68xqo5Vaffy4Kajt4AaABAg,fuck execut admit your bitch,0
Ugzwl6USEnfq_Sndzz54AaABAg,guy such fuck joke like how claim his video,0
UgyydI1fzlVyIRrbNjl4AaABAg,bro idubz beter,0
Ugxz4uoF6Srp_sRhtOl4AaABAg,rice gum litl skini bitch,0
UgwaG_ZTO2Tas382pHl4AaABAg,say idubz dis track bad when your sound like gose gete ran over by semi truck,0
Ugy2V5h3qM-ehvg3jGN4AaABAg,beter thank ghost writer,0
UgwEFkl61uHk_e-bczd4AaABAg,not even tri,0
UgztJKpBSfODE7ZNZwd4AaABAg,pusi,0
UgxhHOm9JEavj5n7J3x4AaABAg,am ashol,0
UgyCS3nF6dzVH2gShXJ4AaABAg,boi not even god at sing like pleas use autoton,0
Ugzc869mY9hH0YJ9UEF4AaABAg,fuck aw,0
UgySSRAo4rX3TfaSYVp4AaABAg,listen anyth rice say disgust,0
UgxdX_zTOsmrfNpsGah4AaABAg,straight trash,0
UgxWOK9OJEccGZw9YpV4AaABAg,delet yourself,0
Ugy_wWlfpYdPyX_kl_14AaABAg,when not have anyth say say your head big,0
UgxP6badJZL-jeTutBd4AaABAg,al know how do flex with money talk big game cant play game though,0
UgwmraF1okU4T_-W73l4AaABAg,fuck suck,0
UgxFWVkp935oluv6VPF4AaABAg,stop,0
Ugzx6PmHyIvWm2zNw-Z4AaABAg,boi if want make dis track never mind not,0
Ugwj-HWleT1wgy4ltd94AaABAg,said distrack beter than his um lok at dislik,0
UgwjW3Is9WXBwVj7F3N4AaABAg,dito litl bitch,0
UgzS8e48L_o0JwA-20J4AaABAg,hate break ricescum idubz dis beter,0
Ugz1aTvG7FjFJ5WaIbd4AaABAg,gez shit teribl,0
UgwHv3sANxJC0vGz6LZ4AaABAg,hey that preti bad,0
Ugxjwt0aoGSiDes_Ort4AaABAg,asian jake paul by idubz tv god this bad,0
Ugy1X65sRFwkeR0Xgah4AaABAg,god just aw,0
UgzrpWeAMXqF1cefu_54AaABAg,you,0
UgzCs8PRikOhn9XxK7F4AaABAg,it time stop,0
UgxmM3ThEKMvJOTnsGB4AaABAg,whini bich did his best fail hard,0
UgxwENdHECtZC7uIBAJ4AaABAg,rice gum mean fuck tard,0
UgxXWUnvbK8X_PLVblF4AaABAg,bruh do even know how dis someon,0
UgxKXRge8TQ8sfy8P5d4AaABAg,hey gue what suck,0
Ugzc3swpzOML0W71qul4AaABAg,wish could se how gay with asian eye,0
Ugy-TeOCvgqXBPySnsp4AaABAg,laugh tryhard crybabi got more dislik than like,0
UgwNY5LzMWCnb8qezRh4AaABAg,oh lord damn patheticboy sound like kid half way through puberti,0
UgwqnFYRk6mmgTzCwHJ4AaABAg,has god abandon us,0
UgyaDQSpXv8ZQ3jYOs14AaABAg,eat shit,0
UgyZnCoxAol81gQP_yZ4AaABAg,god job with dislik,0
UgyvxX28bwHlZ-fUPM94AaABAg,we here sufer,0
Ugx0jWTNW_4IbdHYS3F4AaABAg,no lost,0
Ugw27GxYRrTfYBdLp-x4AaABAg,wow reali piec shit,0
Ugx9av1FbOPKy47Syq54AaABAg,doe video even exist,0
UgyDqeNMN1Vr5GOiwuZ4AaABAg,rice gum pathet loser,0
Ugzuu-SDefDU-I4Y7jd4AaABAg,go fuck yourself,0
UgwwfvN4z9nGLETzQK14AaABAg,stop pleas nerdi white boy beat by milion,0
UgwqtOh_4lsaJAHMLzp4AaABAg,garbag,0
UgzXAEvPXP2muBHs5L54AaABAg,sound shit,0
Ugw-W8ysM9HkQlxgRQ54AaABAg,much crap ned toilet paper,0
UgwlqjHlZ5smx74Zb4J4AaABAg,that terib dis track xd,0
UgyPigXIbiDIO8EYgZd4AaABAg,trash,0
UgzJA_35DNsh12pZmLl4AaABAg,bruh idub kile you not real man admit got burn song most talk about girl or be rich idub actuali expos so not se ani competit,0
Ugy0a1x0IdwBNDJbva94AaABAg,idubz actuali had god point his distrack ricegum say shit like can tel gay or slep with sister even tho none those true,0
UgxKgMPelxTF9-i1ZaN4AaABAg,omg stop not talent,0
UgwNjTVkFtvP07IvhGl4AaABAg,his song beter than anyth youv made,0
Ugx_sgaTo4iEJsZpCUV4AaABAg,ear rape,0
UgzHVVsiO5G2Ru6DIOF4AaABAg,rice bitch,0
UgyMmL-Y3wLCyLYzeON4AaABAg,music video cancer idubz music video beter,0
Ugz1jQu_ke4HoNiGEW94AaABAg,hold los,0
Ugzptzb9SGuzKI-G3vl4AaABAg,crap roast nonexist,0
UgyWsFkGqjH1N_RDrXh4AaABAg,want kil myself ever time hear one trash music video bad,0
UgyzvaVd0RzOC_wFTNd4AaABAg,fuck garbag,0
UgzOkCIcexqMlgSshix4AaABAg,do caus much drama ricegum,0
UgymQhn-iUW_cREC15N4AaABAg,what b,0
Ugz-yHdPJflr1eUE8LB4AaABAg,how do get tast out mouth gag ugh sori it bad,0
UgwE5XLL_eICj4q_PS54AaABAg,has skil unlik,0
UgzvM2BPKqzXbDFtSjF4AaABAg,not even use face or imag anyth dank piec mucus,0
UgzW5JJ3EiqB_3f9dA94AaABAg,destroy you sori laugh,0
UgxC04OxUY3wEzTTUGd4AaABAg,pasin dislik,0
UgyhNjFGephDY9mB1Mt4AaABAg,im wonder who folow are also hate more than hate real jake paul,0
Ugwfq9JHfCfs8nZ6Qfh4AaABAg,bruh it not big deal it simpl mistak pewdiepi made be mean felix ethan,0
UgxcyGYwZ-P7KmCFHop4AaABAg,not anyon onli can say it get out here bigest hypocrit award,0
UgyVjEAAfpwdRBpy-eF4AaABAg,ethan fuck snake,0
UgzxmNIMuo4pc2nmoR54AaABAg,rememb when said diger flagot pfts tske away sponsor remov their podcast,0
UgxZk_gbGLjJsKe4mel4AaABAg,ive watch pewdiepi h podcast one pope up from coment likedislik ratio not think im go like this,0
Ugy-tjlg9JDoECkoKxR4AaABAg,wow ethan shit move,0
UgwpaL_c0rHTgjtNaGl4AaABAg,boar,0
Ugz_VFkNFaFLlubLgUJ4AaABAg,guy reali confus,0
UgyutPZxLOJ3IMAGP5J4AaABAg,,0
Ugzzbltzj6aUSvv2xtt4AaABAg,laugh like god ol hypocrit who got buthurt by someth complet trivial,0
UgyqAIRsDFAPv1c6_dd4AaABAg,rememb fuckfac im sure not say anyth not tel face face cant believ betray friend,0
UgwnkMSdujhL7fB4bJp4AaABAg,backstab,0
UgygkpJ1jtcsW-5WNqp4AaABAg,hypocrit,0
UgwfCTbCrzhZmFrsTgR4AaABAg,stupid,0
UgzIU8fr-kE4UgDEbEx4AaABAg,make disapoint,0
UgzmA68IU-nHm3fCVD94AaABAg,not expect from,0
Ugy9lyGi1r7Xkw1H02F4AaABAg,your not god friend,0
UgzAH9ZbVof5LdrqPeF4AaABAg,your such litl snake who do think are internet polic,0
UgzSgB_wOyeWAEyXwsN4AaABAg,wel complet idiot pule tana here guy,0
Ugyu9DBxD2JYCXqnu7B4AaABAg,ethan ive lost al respect,0
UgzQ3JHrmJGK1XO8foF4AaABAg,delet dis,0
Ugzh0S54voHvFzxuj114AaABAg,eh idk fel like felix wait say like some sort urg think shit blown way out proport,0
UgzPeFMeNtpX7ijxIbZ4AaABAg,rip niga hh chanel go shit,0
UgxhjwD8_RnQ5Ha9SCN4AaABAg,ethan such scam bag,0
Ugz5GHT9znbAJeo8XB94AaABAg,your such fuck tol lmfao,0
UgxRXJGPkV9xaQg9mHF4AaABAg,finali mil dislik boi we did it,0
Ugx3t7MZxnNLSNn04mJ4AaABAg,distrack not even say anyth about idubz it literali more brage what wrong with dude,0
Ugy5Mi_PiFVkcEzHqad4AaABAg,what fuck ashol,0
UgzxYNUzm83DqGK8G1d4AaABAg,yes has chang went from sexist headstrong sexist,0
Ugwb54AhUoeENy5gjax4AaABAg,pise of day his voic anoy to,0
Ugxku6LF95Hqs-mJRGt4AaABAg,idiot,0
UgyvpoyjOGsLDEC404l4AaABAg,when rice doe someth bad past it ok when idubz doe someth bad past should die also mr beast spend money yourself,0
UgyLaNev3KdcUc3M2Sp4AaABAg,not funi almost milion dislik faker,0
UgzWxlXVFSBgXxwkUMt4AaABAg,not meant funi supos show how much ahol are,0
Ugzcf3JwMLralJAC6Kt4AaABAg,dude fase got fuck destroy by idubz,0
UgyuYAMaBvPD8p24Ucx4AaABAg,shamel shita,0
UgznIKH20m7oy1kDBOd4AaABAg,rice gum your shit,0
Ugz3rKLLyL_TLbztI6l4AaABAg,fel like hes talk minut not make ani fkng senc,0
UgwHpIXU2sD5mkf69V94AaABAg,omg that such bulshit,0
UgyLInn77G_E2pEFYhJ4AaABAg,mil dislik laugh,0
UgzpoKylFywfPbl2-hZ4AaABAg,think funi what make him think funi,0
UgzGdcd4iGayitR9mFh4AaABAg,incred ignor stupid it cancer,0
UgxPUMN7M-MWg-DP8jd4AaABAg,bruh wtf bit with rape victim super disrespect disgust se him do,0
Ugx7ieN9YPQpnL82KQJ4AaABAg,ani claim becaus tri make her act more natur that stil ileg an a move hes like bigest hypocrit ive ever sen,0
UgyTk72TLg_aUGzur5t4AaABAg,al brain cel dead now,0
UgwD8ACSZpKO6Mybckp4AaABAg,iq drope,0
UgyJ6-l-KLdZ5HNpftF4AaABAg,big los,0
UgxB-2LUtRtbmAx8pPR4AaABAg,roki po bad,0
Ugyu506etr3YOcSr48h4AaABAg,mate rice gum pleas stop with dis track,0
UgwOXfdMWKHWnR2Cma14AaABAg,deserv wil never get fan back,0
Ugw36LULc9oQwm8taf54AaABAg,fk ricegum frestyl,0
UgwOT-pSGNJjNbXbx194AaABAg,stop delet coment insecur litl child,0
Ugw_P_CXghjwhix16kZ4AaABAg,how piec shit has mani sub,0
UgyLtxhnfxjv3Fn_be54AaABAg,cring,0
UgzKmO5SFxq1D0MrDAB4AaABAg,bore,0
UgwbGtC8C7CG815jQ1B4AaABAg,idubz has point one bigest bitch youtub,0
Ugyile6Q5P8I2jSFJgl4AaABAg,dick head,0
UgyICOG-9b4uMT3lYHx4AaABAg,it hard not watch without glock at head,0
UgxUhVykVtAlqzs7f854AaABAg,loser,0
UgwdMMYzBfYaXSPIhyh4AaABAg,asian boi lie,0
UgxmqlLhZgfxG8swcaF4AaABAg,rude,0
Ugym0G3vCcMH8dGhaax4AaABAg,laugh chanel suck laugh,0
Ugxb7UlmFhvU35eNsOt4AaABAg,ricegum bitch,0
UgxK-8sH-F4tnPChaId4AaABAg,pyrocyn made video about you that how know youv fuck up,0
UgwsPh4uXfRmhb0nuV94AaABAg,love like dislik ratio,0
UgwdQYN39FQdIDcxyz54AaABAg,did tri dis world bigest youtub dumbo,0
UgxIxhopliW97wJEpXF4AaABAg,we should give prop him live exampl iq be ten time lower than age,0
UgzGh2E583cV6fhL2iZ4AaABAg,would tel ricegum donat chariti if could understand word over leter,0
Ugz64i9RlfgK7mFfnfh4AaABAg,deserv anoth one,0
Ugy8JqfzfBQkeLu_jvp4AaABAg,pathet,0
UgwbiEw6P-zptjv4Vq14AaABAg,it pathet,0
Ugw1rahBNjiVgd6O-Kx4AaABAg,not expr how much stil want vomit video,0
UgyJlKh42TqgnWMBaVV4AaABAg,bitch got rape,0
UgxNQuxHPudUoDC9XwZ4AaABAg,guy way wors dumb talentl version nigahiga,0
UgyNfmxzBYrCa7kpmkZ4AaABAg,go back onli remind how much litl bitch ricegum laugh,0
Ugz9NdNdnSLkrk5DqaZ4AaABAg,brain dead moron,0
Ugzuze1WkgBTgfTBX294AaABAg,have mese with god,0
Ugwy-0vD76JVI0KmG4F4AaABAg,hate guy,0
UgzYHGL2W2biwUVS6o54AaABAg,fuck up,0
UgxigScPCOUoTov6_R54AaABAg,scene script it scari,0
UgwPu4ObEcKKybV8EPV4AaABAg,laugh xd litl bitch,0
Ugzkmh5xfXIV_24YgRd4AaABAg,dude ricegum fuck lie whole video such idiot,0
UgwnOhwFC1-s6mmbWXl4AaABAg,say hes not flex hes wear guci shirt,0
UgyvLIu68ATF0IqSJ2B4AaABAg,rice such joke,0
UgymymT_Jy-XzfK9NBN4AaABAg,most dislik,0
UgzSBnkWQ0CDRdread94AaABAg,movi ruin childhod,0
UgzGzQxqybf2FEuTz6J4AaABAg,nah homi fuck of fuckin kile niga,0
Ugw9YC8aVpV3P9bBf014AaABAg,ah yes contribut hate garbag feminist movi,0
UgxXzrQsHSHrnQ6juuF4AaABAg,worst movi histori film,0
UgxxEFbMArg-bFM33tJ4AaABAg,after min quit movi,0
UgxHJ8CgrgbdMGQm-_h4AaABAg,had take masterpiec ruin,0
UgwqfnFqrZOwnzYmeBB4AaABAg,creat new acount can pres dislik buton one more timeand felt god,0
UgxfUHXnc5b_RGwsK2V4AaABAg,congrat milion dislik,0
UgxKt_AQbp4F-0IR8NN4AaABAg,movi with steam pile shit director an absolut hack al joke cringeworthi an obvious flop,0
UgxHwCCiAPxnfWFkBLt4AaABAg,fake,0
Ugz_sBlqjxmOw3liupp4AaABAg,such teribl rebot wow,0
Ugx1jPw4M_BVxbPqIq54AaABAg,movi goe show remak usuali bad idea,0
UgzFe0YxX4g77FFWaFh4AaABAg,came here drop anoth dislik onto huge pile dislik,0
Ugyc9MRaHMbaESi_hrp4AaABAg,teribl,0
UgyIVg1rqFeUKssk1PR4AaABAg,pathet wast shit,0
UgxcgvqHBaYlu0Veu4l4AaABAg,movi fuck dumb am go kil year old again,0
UgwELM3GomoRMz5RUNZ4AaABAg,absolut shit show,0
Ugwi8ocA2FvAvqW7w1N4AaABAg,rememb when thing neither did,0
UgzGnmWAGgASaNOXGPB4AaABAg,feminist movi suck as fuck,0
UgwyCEtNDbYMhDEr2B14AaABAg,soni fuck up,0
Ugx1CYesMeOcBCYdr7R4AaABAg,came do part,0
Ugx3GReHYumED1MBM_Z4AaABAg,who gona cal not trailer,0
UgzMhd-ncyy3c3NHFiZ4AaABAg,real horor movi caus not wana se it,0
UgyW-aVGdBd1TsUqLJh4AaABAg,bad bad veri bad movi,0
UgykTJulbGL6HbLPWdF4AaABAg,watch gave corona,0
UgxbPAkEX8AxLZdJpJB4AaABAg,shit suck,0
UgyM5H3MiaKCNg9Sb9F4AaABAg,most dislik movi trailer year until sadak congratul,0
UgxjqRcSLlC9_nlcI5R4AaABAg,releas at point even plausibl idea,0
Ugz1UDDNRrQa7j6hvgx4AaABAg,shit movi crap,0
UgzQLFLnwlvhPGPB2X94AaABAg,worst movi ever,0
UgxjGC8DsgL9aeoCz4B4AaABAg,peopl who think movi shit,0
UgyTqOfPpZ0Jrb77txt4AaABAg,stil crinegi asf year later,0
Ugwvlzd6raw26qdohi54AaABAg,humorl feminist propaganda,0
UgwJjAQCpdDr3v9yw2l4AaABAg,came se if dislik stil here,0
Ugzv48LdXnwMvn8vpCt4AaABAg,movi such disapoint,0
UgzwKsYXEDl_f2DDNIR4AaABAg,who came here after sadak se dislik trailer laugh smile,0
UgwOUAn47prr7cAfbHt4AaABAg,so when cros stream creat an altern realiti suck,0
Ugzx1nS7r8C672pYiHF4AaABAg,thank ruin childhod dickhead,0
UgwmA4zWx84v_FWjWJx4AaABAg,may movi remain forgoten buri dep insid anal histori,0
Ugx8GdTfogd5KCgdNqh4AaABAg,w the real one not cod game beter than garbag,0
UgynrIdietrk0lraVxF4AaABAg,came here dislik,0
Ugw7of_3zZYQjBTFXtV4AaABAg,here dislik cari on,0
Ugz0D1sVDU8fDFyDlrN4AaABAg,whos wast their time get lok at dislik,0
UgxdQV4aTx10BUvKKWl4AaABAg,bruh cring,0
UgwgTcbAEudZljS8qY54AaABAg,oh man bad,0
UgxtUbZxSB63JJut20l4AaABAg,bad,0
UgzwhNNrc5mKgBTX1194AaABAg,wow milion dislik internet did someth god,0
UgzqlQxNvKMwWag3hAp4AaABAg,youtub rewind dead,0
UgxzDGk_y06RmnNogWx4AaABAg,bad,0
UgyMOxPgV0wAarDRwbt4AaABAg,not even an f chat one teribl,0
UgxWBHVtY9vJ6zhgddN4AaABAg,tele fortnit instead minecraft those dislik deserv,0
UgyBTn3y66WlOLnGxs14AaABAg,if control rewind would delet video,0
UgzJA2gkK4z8paTdoaR4AaABAg,it god wdym guy mean it bad,0
UgySAxudx971kE6gVHp4AaABAg,what heck,0
UgxHEYSqSWTWZyIL1zF4AaABAg,cring,0
Ugz9mucGNOl2lDicaP54AaABAg,opinion onli god thing about kpop laugh,0
Ugyq7jW4pZl3u8sLjbt4AaABAg,rememb when rewind god yeah neither serious though after al went dowhil,0
UgzjIyVbBU8474AAVfF4AaABAg,this is aw,0
Ugy6-kYTe6PSAqSWnSd4AaABAg,metal gear die,0
UgyWxMaK-Ig3TkqrkLt4AaABAg,nightmar,0
UgzkPhpvTFkRph4Gi9x4AaABAg,destroy metal gear game money gred onli,0
Ugz4-35YElca3BLxHvp4AaABAg,metal gear tri surviv,0
UgwbnROYhxWuL-_rAVF4AaABAg,metal gear rise metal gear surviv,0
Ugxddk8Wo2Sct5azClV4AaABAg,metal gear has die,0
Ugxp7-WjgXJMM6L6Zf94AaABAg,refund,0
Ugw_v5Uu6i_tKtQqfGV4AaABAg,wost then dead rise,0
Ugy9DryOKw83yYjvDwt4AaABAg,have fele il not like game il safe money complet ruin metal gear solid saga,0
Ugwt2kM0Twmf2mrStZZ4AaABAg,may prolif say abort game,0
UgyqcxJbeumv1mFsAR94AaABAg,konami kile metal gear,0
UgzNCJrGX2_A2c9dRKt4AaABAg,nobodi buy,0
UgyZ_w8acWhXIsuyXTR4AaABAg,al kind bad,0
UgyjyPRjwrJBOuhyJo94AaABAg,laugh not joke,0
UgzIDUCm3jUtnanJTzl4AaABAg,lok like metal gear franchis wil becom wors like sonic hedgehog fuckonami sliperi litl bastard,0
UgxFb0zM4J77-8r5Oxd4AaABAg,no no,0
Ugxd8T5M39WERI-aygx4AaABAg,we stil here sufer,0
