comment_id,body,rating
UgyP5t0QGHcat5c6nzJ4AaABAg,lok like konami game bad,0
UgxYf4QMNd27UKhDfeR4AaABAg,fs konami do,0
Ugx5dnee_dOsGH8_G7x4AaABAg,bulshit beter get cancel,0
UgxEGIUXoKySzvkTfKx4AaABAg,no no,0
UgwG9uonCedGTDn2CV14AaABAg,yo konami smoke crack,0
UgzTgoFehG2kZqnENcJ4AaABAg,bad,0
UgzZchXLNCM4O_uIMb54AaABAg,game more dislik than infinit warfar understand whi piec crap not ned metal gear titl,0
UgzY7OlY3PDZhx5DE7V4AaABAg,godwhi,0
UgwlKgQCIeqmX1y3Ym54AaABAg,bulshit,0
Ugzq4ehfhbk0CnGy0-p4AaABAg,we stil here sufer,0
Ugz13HTSXanuFsMjxQx4AaABAg,they play us like damn fidl,0
Ugw8n9AzYfNTU-OjwTV4AaABAg,yeah il pas,0
UgzGDHz1ni_VXVPYQ0V4AaABAg,horibl st cant cale metalgear,0
UgzPTTl_hDi4D_8KaYR4AaABAg,love metal gear as stealth shote game konami gona ruin beauti stealth gameplay,0
UgyCzZs6KrFm5a5PK7F4AaABAg,ned more dislik,0
UgzeTzFlgnzZYLA9DSd4AaABAg,what actual f they turn our beauti world into fking resid evil gr had some faith konami we want kojima,0
Ugx6KwwbPTxh8NC0krF4AaABAg,,0
UgwNk_8raKv17jBTexR4AaABAg,cant believ favourit videogam seri has ben ruin im stil play metal gear from damnit,0
Ugw_NgXITYYQuIJVo1l4AaABAg,also pathet prequel omfg,0
UgzloO0iJ2rHEa6-5mx4AaABAg,cant believ they ruin,0
UgzoroBhaZYoIRd4Qpt4AaABAg,not preti god,0
Ugiy768yLvJnyXgCoAEC,wel done konami destroy mgs franchis bad,0
Ugg1nMul-wmWUHgCoAEC,konamiwhat did do,0
UggjtwqRh8ZpcngCoAEC,metal gear dead left ruin anoth part childhod dead,0
Ugg9wF6XYvOQ-3gCoAEC,metal gear surviv more like metal gear dead,0
UgirUYk7t4bUtngCoAEC,record dislik laugh,0
Ugh_fEYQl301cHgCoAEC,pure bulshit stickstop madn pleas,0
UgyFhdXwVf2jBKisfgh4AaABAg,rip video,0
Ugh_nH1WdUVa3ngCoAEC,oh fuck,0
Ugj9K0gI5QiSAXgCoAEC,dislik squad where at,0
Ugid2-Zla8TfrHgCoAEC,loke at video make realiz how kem fuck anoy,0
Ugih4fax3CdRJHgCoAEC,prank invas trash,0
Ugirqww21hMQ4ngCoAEC,fuck leav peopl alon,0
UgjGJWd_ni96eXgCoAEC,kiler gnomestar let get right into cansur,0
UgiADTDjxEQeKHgCoAEC,cancer,0
UggeZXvoTdO1B3gCoAEC,kemstar such piec shit budi,0
UghGau8vgCcmy3gCoAEC,chanel cancer,0
UgjuNW_IBEY1jHgCoAEC,wow k dislik nice boy,0
UghWmhstnt-gFngCoAEC,kem reali stupid,0
UggRnBjtTjTxdngCoAEC,biast asf,0
UgjClJgPNPlSingCoAEC,fauq thingk,0
Ugir5Z-YKpbLgXgCoAEC,dude has retir from life,0
UggCemK4-a76dngCoAEC,dear youtub may pleas dislik video multipl time,0
UggolDDyujH2SHgCoAEC,gnomestar go back garden where belong,0
Ugju3LsIpPHom3gCoAEC,complet bulshit,0
Ugh3QAmOigfLt3gCoAEC,am stil gete hate,0
Uggyibfcq342KngCoAEC,your trash,0
UgijnYHd0WLiO3gCoAEC,fuck kemstar,0
UgjBrS6BGV6ePXgCoAEC,wow piec shit,0
Ugjg_RJstAN0pHgCoAEC,search vid dislik,0
Ugg7nMBv5PJGeHgCoAEC,um kemstar leafi gain sub becaus wel hes god youtub much more then youl ever be,0
UghNZa432s7MLXgCoAEC,babi man hilari got sue sucker,0
Ughmle5vrBHoHngCoAEC,wow kemstar moron godam,0
UggPZf8Ei4ocIngCoAEC,not understand dickhead stil youtub,0
UgjzUpBDC8DZUngCoAEC,do do youtub piec fuck shit everi one hate dumba,0
Ugj4lruhGyycvngCoAEC,omg pls stop kem pls bro stop god,0
UgjI5UdVVzjEfngCoAEC,im gona state some thing not understand concept chanel whether or not fact present true plenti these video ful slander question ask how doe chanel exist,0
UggsT1n3AEKkEngCoAEC,hate voic more than fcking elmo voic,0
Ugh3ZbEQ-CzYcngCoAEC,ya know atleast leafi funier than you,0
Ugg7gk2JowPEAHgCoAEC,pleas take guy hospit older than grandfath play hide sek with children,0
UgiB9tIJ_Xf3S3gCoAEC,thank second intro that anoy basic af thank wast second life everi video onli drama alert can provid,0
Ugg64mkBplTzuHgCoAEC,can smel bulshit al way from england,0
Uggantj5f_mXgXgCoAEC,fuck kemstar,0
Ughpdp3Px9JNTngCoAEC,watch fol like contract diseas,0
UghRrHQMRTQdFXgCoAEC,fuck chanel sad,0
Ughrna0oCl_bzHgCoAEC,fuck piec shit leafi beter than,0
UghFsmRSmAyyRngCoAEC,wow drama alert make fals acus what disapoint,0
UgiquLt3N4nm-XgCoAEC,complet piec shit whi am stil gete hate,0
UgjTK32DGXgiD3gCoAEC,grow up daniel,0
UgjDo5a-KXEh03gCoAEC,dan how do live with yourself scumbag,0
Ugg_YXdGuoy4_HgCoAEC,laugh dislik laugh,0
UgjHYYkY42NujXgCoAEC,let shot k dislik,0
Uggccy2N4t0wg3gCoAEC,kemstar fuck hypocrit kemstar get news wrong al time yet fuck acus scarc gete news stori wrong no wonder peopl not like guy,0
UghnOmEqby1aAHgCoAEC,wil enabl adblock onli chanel,0
Ughk9e1d5IOoyXgCoAEC,hate kemstar,0
UghMtZnf9cQ3AHgCoAEC,wors than infinit warfar laugh laugh god,0
Ugho0G2uDNr2tXgCoAEC,it fuck fake dumb fuck listen scarc,0
Ugh1TLCMMYluDXgCoAEC,kemstar shut up,0
UgiWxVAAwewuXHgCoAEC,dislik bant,0
UgjTIFLebLNxMXgCoAEC,kemster manipul fuck,0
UgghRRCZQepw7XgCoAEC,peac youtub wil come when kem gone get hel out here kemstar,0
UgiKONM_e-4TTngCoAEC,peopl like make se beauti person am take dislik grandfath,0
UggaGbav1lE21ngCoAEC,can plz quit right now,0
UgiPYSccfoOq83gCoAEC,guy cancer,0
UgjvPWEeMrSGP3gCoAEC,niga lose sub yay,0
Ugj2eGqR7ep80ngCoAEC,holi shit dislik sad excus video,0
UgiMHj07v7ter3gCoAEC,holi fuck come back how mani more dislik bid had it tripl sinc last dislik last time ratio likesdislik kk,0
Ugh4gEpnahTkhngCoAEC,rose red violet blue guy said leafi subot none true,0
UgjLGlgC21_u3ngCoAEC,never have anyth back up what say reali not know your gete hate,0
UghnagXIE6HRCHgCoAEC,kemstar most sadest manchild youtub ever,0
Ughgg6wwGN_7bHgCoAEC,kemstar fuck loser,0
UgjMqGr9N8d5jXgCoAEC,fat fuck no one like,0
Ugg4sbdEx0K1_ngCoAEC,get aid watch guy cring factor oml,0
Ugg3XJzHCApyU3gCoAEC,what up dramalert nation im host kila cumstain let get righ into news,0
UggiZSx7ZLd0xHgCoAEC,prof it fake gnome admit his friend evid fake pleas do someth with pos news,0
UghMN-zlIRHFU3gCoAEC,mani dislik laugh,0
UgxbGFKEbagU_gU-_194AaABAg,laugh your fuck stupid,0
Ugyg7a_UgY9wGXJlfAN4AaABAg,some bulshit,0
UgiD1Xx6Pp_8v3gCoAEC,fuck idiot would have ben bane alreadi not believ everyth subscrib tel you idiot,0
Ugif5gw4xG6RS3gCoAEC,bulshit leafi not do,0
Ugh-VepHeUe4IngCoAEC,jealous,0
Ugih7n5oBlrBcXgCoAEC,kemstar buli,0
Ugjj4w5jvgqp8XgCoAEC,visual herp,0
Ugg1QzjOKJQGmXgCoAEC,okay bot day sub wek said jump up one second would impos shut up kemstar neutral god,0
UgilHNzT1nfwMHgCoAEC,screw kem,0
UggoAti-T5SZingCoAEC,,0
UgjFNIKVrZRCRngCoAEC,if your kemstar fan know wait let stop right there who exact fan lie gnome,0
UghBYnv37M3QYngCoAEC,there not enough dislik,0
UggJF4JMuK2AtngCoAEC,fck you,0
UghoEuZ0U6BpkngCoAEC,can wipe of leftov bulshit mouth,0
UggtUIMKsjweTngCoAEC,nope bulshit reason part vid kemstar act like al misunderstand reason in vid say leafi cale him buy bot subscrib reason fuck bul shit leafi got sue kuntstar,0
UgixoCGxX7smw3gCoAEC,kemstar bitch,0
UghU0ix1FgV3vngCoAEC,dislik win boi yay,0
UgitZ1LT82oVWXgCoAEC,hate kemstar,0
UghAkTSakWJMgngCoAEC,warm heart se al dislik,0
Ugh5zlWmzph76HgCoAEC,drama alert has no chil,0
Ugi3MdjAU9ARengCoAEC,dick,0
Ugjfru7VVHa4hngCoAEC,no one like delet chanel,0
UgivIknTJoufDXgCoAEC,if ken star fan know im onli gona tel truth yeah sure ken star definet totali truth,0
UgheyieiYd58mngCoAEC,your such piec shit,0
Ugh0i40UI7WHkngCoAEC,fuck of,0
Ugj859pVjr1OpXgCoAEC,your gnome,0
UgiRKy3txCWPXHgCoAEC,amount dislik not surpris,0
UggAD2xYfYp8aHgCoAEC,slander,0
Ugifxf6emOZv93gCoAEC,kemstar fuck stupid,0
UghcReZU_THpangCoAEC,most bulshit kem star video tel truth bulshit,0
UgjN8-1DHeDr0XgCoAEC,fuck kemstar,0
UgitH1s7dE16DngCoAEC,not have leafi fan know your liar laugh,0
Ugg8xH4us6InKHgCoAEC,helo am gnomestar dislik bot dislik video work here done,0
UghOHga01g0HQ3gCoAEC,oh pis of sad litl man job read out twet,0
UghDUKicRJzM3XgCoAEC,if your kemstar fan know onli tel truth im not sure whos spread more lie kemstar or hilari,0
UghTIAk8iokpBngCoAEC,stupid,0
UggdynHDQ1G6q3gCoAEC,nobodi go believ caus your not tele fact,0
Ugj_TOGnFm07jXgCoAEC,laugh dislik god know other peopl think kemstar usel twat who deserv homel,0
UghMurhKyoTnnHgCoAEC,never tel truth,0
Ughtll5cu5j-73gCoAEC,kemstar gay,0
UghUjgGf8k7x4ngCoAEC,also thank give aid zika,0
Ughi2gdxaDybRngCoAEC,more peopl ned unsub pleas,0
UgjPsxisCV8A1HgCoAEC,stfu fuck liar,0
UgjFaz2uX4Au-3gCoAEC,holi fuck intro make want rip ear of,0
UghQoaVURzPlZHgCoAEC,kep suck did not subot,0
UgiKmB6pzLz0QXgCoAEC,honest bulshit stil love leafi,0
Ugh83U6u0zztIngCoAEC,what excus now shitstar,0
Ugj-4uX4q7zK9ngCoAEC,that lie like life,0
UgjOR4hc_o8RwXgCoAEC,traitor backstab own friend,0
UggU3y2vA_CALXgCoAEC,everyon report video laugh,0
Ughl5_rf0MYWV3gCoAEC,fuck hate dramalert,0
UgjV96gaj42-33gCoAEC,cant handl how dumb,0
Uggu5ClJqlTVOngCoAEC,kemstar go fuck self everi one dislik vid niga got noth say lmoa,0
UgjNMOFgIZhqCXgCoAEC,fake,0
Ugi8SrhXIvATRXgCoAEC,your dam rat,0
Ugg_195FDc6wXngCoAEC,youtub chanel not taken down,0
UgjOsmBw3ZSktXgCoAEC,fuck kemshit,0
UgwxZloSgG8PUqJWm0t4AaABAg,fuck guy,0
UgypHGOAXiMwiID0-Kp4AaABAg,what did think meant got out hand real fast,0
UgxLliM6bQx3VHj9HH14AaABAg,bitch,0
UgylGWSFI2spckZ14bV4AaABAg,cring when irelev,0
Ugze_PHKSTfDNGHMZX94AaABAg,am ksi fan rude disrespect racist,0
UgynuxO6XPQVZX1mM_F4AaABAg,ksi roast white chicken leg,0
UgymqoaBu1YUFbe5OaV4AaABAg,racist fuck,0
Ugy98GzZmODHUv9CORx4AaABAg,take al dislik bruh get rekt son,0
Ugxzk0GNp5ful1tskJx4AaABAg,ya know stupid piec shit,0
UgywPB2C7aNJQERCYC94AaABAg,suck,0
UggHvUS58iBm9HgCoAEC,fcking racist,0
Ugh7ej-ppYQg4HgCoAEC,cring high,0
UggvGsK45BmgSngCoAEC,cringyn video made onion cri,0
UghH5LIyvriFangCoAEC,fuck,0
Ughraof1ChobnngCoAEC,fuck cring,0
UgiJ385LXDLjEHgCoAEC,mum stink,0
UghjEh6elA5GCXgCoAEC,fuck bro fuck racict,0
UgjiQYkooKzA63gCoAEC,omg fuck god guy fuck cring worthi,0
UgjT8-iK_ILhkHgCoAEC,wow fuck hypocrit content not fuck react anoth person video,0
Ugg5x3Ax0UMWYngCoAEC,fuck idiot pick fuck wrong black man idiot,0
UgjvMP7qfo2ze3gCoAEC,rucka rucka wast oxygen earth fuck of piec shit,0
UgiDEG3EFC-IvXgCoAEC,fuckin racist,0
UghcQozhckXTwXgCoAEC,much hate not funi,0
Ugjj9fMfSebkFngCoAEC,fuck racist shit ruckayou make al black peopl mad n pise of bitchu,0
UgiFzy_oezoxpngCoAEC,fuck born shit,0
UgiUMILUVuMggngCoAEC,racist son bitch,0
UggaY0ehTSsjeHgCoAEC,your shit at rape plus not do music anymor ksi much beter at rape then,0
Ugj2ikCLknEeF3gCoAEC,shut fuck up,0
Ugh2PrGtwca07HgCoAEC,your fuck rasict,0
UghyM_cRk33DTHgCoAEC,hate much dumba,0
UgjH80sBoDyzeXgCoAEC,laugh dislik video what fuck loser,0
Ugii1tm_yTz21HgCoAEC,what problem man digust,0
Ugj8ipy8kFOQQXgCoAEC,ksi has beter content than,0
UgjMGKuajOj4cXgCoAEC,fuck hate guy ksi beter than,0
UgjM-99qUtkokHgCoAEC,fuck of rucka rucka bitch,0
Ugj2_xzDRROzyXgCoAEC,love how smile at mexican part over react obvious fuck satir parodi clear say it joke,0
UgiGlr47Vcifk3gCoAEC,from one black man anoth wtf onc again have more dislik than like racist niga,0
UgjC2nlVxYxdk3gCoAEC,ali laugh wtf trash,0
UgjImfMR-qpWfHgCoAEC,dis dude ned stop not entertain it bad,0
UginPyxLkq6ekHgCoAEC,fuck him,0
Ugjj4fYhBp_PwXgCoAEC,like way actuali think peopl know who are rucka think whole generat listen shit no one rli care about chanel,0
UginDygrIeU7B3gCoAEC,sad litl fucksal xd,0
UggK8iEVqyPkOHgCoAEC,it cringey,0
Ugj3WS4bA2QRM3gCoAEC,should bane from youtub,0
UgiinEirLWerPXgCoAEC,ned shut fuck up,0
UggwtC2fNi3GJngCoAEC,if video actuali god itl go viral itself wel then your shit,0
Ugi-CPOJa8jBQ3gCoAEC,that not even ksi should read what chanel racist fuck world not white man world belong black peopl aswel,0
UgibQCXn9106XngCoAEC,gay,0
UghMNH4blbPPcHgCoAEC,funi how fanbas ten year old take advantag social media,0
UghPtVG27u_GG3gCoAEC,were go get bane tube,0
Ugi6Vqn-FXdcMHgCoAEC,that not entertatm that strat up rasist,0
Ughr6eWnsD4dyXgCoAEC,youv ben longer youtub than ksi has ben abl vote yet make more money than life save day,0
UgjTNVpsEX4OT3gCoAEC,go frick yourself rucka,0
UgjvLUivUrqKsngCoAEC,dislik bitch,0
Ugg4qDRaxXRliHgCoAEC,thing with bogi fake,0
UggcOkPQzr2StXgCoAEC,fuck degener,0
UgiEuVoI5XfK_3gCoAEC,let wait until dramalert get hack cmon podlecorp we wait,0
UgjmSm862N_yPXgCoAEC,what folishn internet not local news,0
UgjvV-mSI869kngCoAEC,chanel literali go shit,0
UgjEeS9linQOwngCoAEC,stop now,0
UghFNkB48JOyP3gCoAEC,fuck kemster,0
Ugg0KUcimgOw3ngCoAEC,drama alert more like cancer alert cough gradeaundera cough,0
UgjhUBLiz9F09XgCoAEC,your bitch laugh,0
UgirbNXrwFuILHgCoAEC,how about ignor kem,0
Ugiq5yLBWNwszngCoAEC,rip cancer fuck,0
UggS8AP6lobBYXgCoAEC,kem youv brought upon self deserv,0
UgjSfOv-bG0J5XgCoAEC,cmon guy let al unsubscrib,0
UghIfY3aU8ONpXgCoAEC,chanel curs,0
UghYvvJdjMe5XXgCoAEC,guy fuck joke,0
Ugitc21IjbOWv3gCoAEC,wow super sub los f dramalert,0
UghLBSQ8IYLiPngCoAEC,super mean cri when someon say al fan make fun someon with cancer,0
UgisVlYNCFJF8XgCoAEC,chang damn about tab now,0
UghEBDykFps0C3gCoAEC,scare beter,0
UgiXujIVKF-gEXgCoAEC,news bitchbud leav chanel kem find beter friend,0
Uggi96ECdZnJC3gCoAEC,if kem here fuck him his fan as would say fuck fan,0
Ugglj0ynGz0UFXgCoAEC,now no fuck kem,0
UgipewiYZFdXb3gCoAEC,fuck there popcorn background,0
Ughy5NElFvd9IXgCoAEC,worst kid ever,0
UgiGeiPNQNBTiHgCoAEC,not here it cancer yt,0
Ugimgs3t66shvngCoAEC,what doe be second fel like hear it shit,0
Ugjm1kYL2djmgngCoAEC,sit back relax grab popcorn watch drama alert sub count go down,0
UghfoBL6nS33oXgCoAEC,holi sht gete down canot find singl normal coment which god d,0
Ughzqzy2VC-7L3gCoAEC,fuck bith,0
UgghUxupVz_nRXgCoAEC,chanel fuck idiot,0
UgjKM9sed54hQHgCoAEC,number bitch,0
Ugj_rWGI-HTbungCoAEC,aw where ugli thing aka kim,0
Ughhv0fkliRt6XgCoAEC,no one love kemstar,0
UgjdEe906wUY5XgCoAEC,kemstar how fing evil,0
UgjtN85FfOBS2XgCoAEC,kiler gnomestar decoy here shit,0
UgjvgEZK7tuH03gCoAEC,get life piec shit,0
UgjTC6ZdBvuppngCoAEC,fucktard ned remov from youtub efect imedi,0
Ugiy4CfvzbN413gCoAEC,yeah se sad desper man who cant control himself,0
UggjKS3wOFwniXgCoAEC,guy childish,0
UghcTVKHVuDrO3gCoAEC,what kind man make his live ruin other peopl live,0
Ugi3nr7QOBtkCXgCoAEC,what sad joke kemo,0
Ugi9QEFq_9KrMngCoAEC,not even half minut alreadi got cancer wow,0
UgjavaoKMy47bXgCoAEC,scare beter,0
Ugh-Gt6fgb4cQXgCoAEC,laugh youtub guy destruct,0
UgjltyvaVcwr13gCoAEC,leafi way fuck beter than bitch came here se if al bad know fuck bitch,0
Ugj8yUCg8SwTVHgCoAEC,shut fuck up kem,0
UggW41OMDUelTHgCoAEC,back,0
UggnBrEcH0JpN3gCoAEC,doe alway move his bodi at start it cringi as,0
UgiUFThZFfkGrngCoAEC,yup grown man saw leafyisher video ran dolar tre grade fake knife tape his back,0
UggMDidiM26HOHgCoAEC,bo not veri god at al,0
UgjH0yLeQnbu2HgCoAEC,,0
Ugj-SgIGVue87ngCoAEC,stop,0
Ugg8ZnbVpqfS43gCoAEC,everyon unsubscrib from kep,0
Ugjlzjr8LrJw-HgCoAEC,now your number two laugh,0
UghMcAGdgQ1DRngCoAEC,wil alway how doe fel,0
UgiG4unktqNlVXgCoAEC,make fun peopl who have cancer mate fuck cancer,0
UgirNb4Txadys3gCoAEC,chang bio sourc news internet,0
Ugjks-KaWnNGJ3gCoAEC,drope by say fuck,0
UghQDFpESNCNsXgCoAEC,fake,0
UgiV2o49mvA-zngCoAEC,number bitch,0
Ugj2W2oUsrqPTngCoAEC,reali hope knife real,0
UgiF52LbPYvUNXgCoAEC,no not se anyth back becaus overexposur aw light,0
Ugja3PVKKUH9qXgCoAEC,mole rat,0
UgiNLQx6bL1viXgCoAEC,fuck,0
UggGvePnnvezzngCoAEC,neck yourself kem fuck fuckwit do even have life,0
UgirtAfN4pF2xngCoAEC,laugh bitch no now sack shit,0
UghDDVB4bBpwvHgCoAEC,racist litl bitch,0
UggEt1YMHYTzdngCoAEC,your litl bitch,0
Ugg_hGWK-AN9VXgCoAEC,yes k dislik,0
UghRjCFamIjctngCoAEC,rat,0
UgidWmHAFcitAngCoAEC,dude not funi,0
UggrusiKhMJu0ngCoAEC,dude if ever saw fuck public would kick his as,0
UgisJcVlQjq39ngCoAEC,leafi kile you,0
UggGkDUX8zkST3gCoAEC,video gave aid,0
UghCQ4nylRkb8HgCoAEC,,0
UgjMwGtVQyuia3gCoAEC,id prefer have lego sock forev than have aliv,0
UgjbIQS7MEBTa3gCoAEC,beter person,0
UgivL6-05NogO3gCoAEC,notic how youv lost ton sub laugh fuck bitch god hishi,0
Ugg0OpYpUdiS-XgCoAEC,wow pusi not even use real knife,0
UggGlSgjda7x7XgCoAEC,oh not under atack big bitch,0
Uggc8rvN3IJicHgCoAEC,know what wil never half youtub as leafi man child,0
UgjJRXdwQZNkbXgCoAEC,bye fucker,0
UgjmddN39yZFzHgCoAEC,guy make live of news report about youtub drama piec shit,0
UghnQY8HE0EthXgCoAEC,fuck pig,0
UggM6pg6j0wTFXgCoAEC,what dush bag,0
UghCb6zFzPwInXgCoAEC,how did ever get famous,0
UgjAsfHqaDPco3gCoAEC,fuck you,0
UggkWjTSy9QCJngCoAEC,pls stop with yt midlif crisi babi,0
Ugg_L4Ov3pKGEHgCoAEC,kem make sick stomach,0
UghV3Z-Th-usCngCoAEC,no one like,0
UghW19gvk6P_QXgCoAEC,that rude think should end chanel,0
Ugh6wciEt8AmV3gCoAEC,dude ned stop make vid apolog get fuck of internet,0
UghpuPAGuT3bHHgCoAEC,fuck,0
UgjSl1iKzFD6F3gCoAEC,intro gave aid,0
Ugjhix9FCxzzL3gCoAEC,dude not make news,0
UghVmQ_3-2hZingCoAEC,wow coment got delet yay,0
UghMaC8Y8zch6ngCoAEC,preti fuck childish se year old man make back stabe joke like serious kem grow up,0
UghGG9heyfYZl3gCoAEC,cring,0
Ughlr-vlpjWGjXgCoAEC,when forget were one who backstab friend,0
UggCnuEmm666PngCoAEC,kem star can quit youtub,0
UgjPLDSAPu3IKXgCoAEC,ken star should quit like said twiter,0
UgiYAGhSzBaSRXgCoAEC,unsubscrib,0
UgjGQFeSsAriongCoAEC,talk crap no one care about,0
UgicFA1yKwGWXXgCoAEC,fuck rat,0
Ugij1FGEobsnGHgCoAEC,rat,0
UghGLSX8dLY8l3gCoAEC,here lie kemstar carer,0
UgiyDRCcOFVE33gCoAEC,fuck guy,0
Ugid5_qZSPaY1HgCoAEC,your fuck horibl person dude,0
UgjpWeqeaSx-pXgCoAEC,laugh ugli fuck peic shit hope quit fuck drama caus old fat fuck,0
Ugi2RaKXXIjRy3gCoAEC,oh babi k dislik let kep go,0
UgihJoTNZiJ553gCoAEC,fuck of,0
Ugg7JzZPGlzIQXgCoAEC,worst youtub ever,0
UggGUYpYOyXgpHgCoAEC,hate guy,0
UghU5LqzvVzwkXgCoAEC,,0
UgiNMLQEV--cg3gCoAEC,your bitch,0
UgiCSfIwllPwengCoAEC,fuck,0
Uggzz7c2lJb-h3gCoAEC,,0
UgjgqEQ7dVeczngCoAEC,made year old man cri fake pedophil aleg,0
UgjZCAoXb-kgSXgCoAEC,regret ever sube piec shit,0
UggLu0NWWKG2DngCoAEC,sube could fel joy unsub,0
UgiKFOTHHvPMTXgCoAEC,gtfo from youtub kem,0
UgjX_e6AW0b8ZngCoAEC,have kiler name becaus give peopl canser,0
Ught5m0H5MiKXXgCoAEC,not know what worst his racism bulshit his fuck voic or musti beard,0
UghbmRGksjyWhHgCoAEC,take los,0
UggMNelELy1fhHgCoAEC,joey vid great fuck guy,0
UgiistIfTKRd7HgCoAEC,preti sad think milion peopl actuali subscrib cancer youtub,0
Uggja41P_CmQ4ngCoAEC,what like be such hypocrit year old prick,0
UggqqoasTs3AhngCoAEC,fuck dude,0
UghG1uS9T-EtrXgCoAEC,onli watch chanel se giant sub count drop,0
UghYGmVhyJ1uQ3gCoAEC,no one like joeysalad but no one like either two bigest cring chanel internet,0
UgjuP_Si2PsjX3gCoAEC,of with chanel,0
UgiRSKxVjgkwFXgCoAEC,bad person,0
UghdtW7lOGeTTngCoAEC,quit youtub alreadi jesus christ,0
Ugi66VOBbyLypHgCoAEC,im hapi kemstar chanel lose sub,0
Ugj59GGYgT2l8ngCoAEC,kem leav pleas,0
Ugi67IkIG6i3gXgCoAEC,fuck,0
Ugi6rtzM6uzRDngCoAEC,uh oh delet coment again how sad,0
Ugj4ywZSt9g8PngCoAEC,sube can fel joy unsub,0
UgjuxNCzBl_MJngCoAEC,doe chanel stil exist,0
UghuCcaYqwYj9ngCoAEC,joey salad take fuck video down kem how about take chanel down,0
Ughth1irQHcnKHgCoAEC,voic anoy,0
UggClOqXemkmy3gCoAEC,when subscrib drop get hapi,0
UgirRj4RNUnPNHgCoAEC,guy stupid,0
UgimKKhpfRphEXgCoAEC,insensit stupid ge wiz kem calm down with self hate,0
Ugj73EwmtfyM7HgCoAEC,lost k sub from leafi lolololol deserv,0
Ugix6ryqIpcu43gCoAEC,oh god price shit godamn anoy,0
UgjBZTaulnbnlngCoAEC,what hapen dramalert be unbias also kuck femstar,0
Ughx-EE_qjMPl3gCoAEC,fuck guy,0
UggZ9FcAqcxxJXgCoAEC,dude fuck chanel dead liter,0
UggN4pymeKb10ngCoAEC,,0
Ugj4Dydbe6IECngCoAEC,wtf hapen chanel,0
UghvXjmPuVNR3HgCoAEC,his chanel should burn ground give fake gosip his own amus let end his chanel let end him,0
UghCs--sboDKBngCoAEC,cant wait report chanel death ha ha,0
UghMaEQXa82klHgCoAEC,leafi expos fake as,0
UggtIDMMJRSqxXgCoAEC,who els dislik befor even start,0
UgiOUNdkgxa7M3gCoAEC,xd subscrib count so fake,0
UghYEcVB-c81WXgCoAEC,moment when bleach beter than show do us al favor pleas quit job as youtub news host,0
Ugi5gs37JEFxBXgCoAEC,like how help codi kid everyth els do fuck dumb insan,0
Uggcul57YvTu9XgCoAEC,youtub lete cyberbuli make video has no god content it wors then year old let play minecraft,0
UgjIf1NplYCcNXgCoAEC,hope youtub war fuck chanel unsubscrib not do caus leafi am do becaus way act,0
Ugjum9FvwyjiN3gCoAEC,holi fuck kem huri up make respons video can unsub laugh,0
UggvRq66ESJwe3gCoAEC,no one like kemrat,0
Uggdxa1hSOwaS3gCoAEC,his screw,0
Ughj-oaznk0wGXgCoAEC,fuck aswip his,0
UgjlsO2gLewiJXgCoAEC,fuck,0
Ugj-I4T2BsZJKXgCoAEC,get of youtub,0
UgyYn008sCTgyoty8KN4AaABAg,someon gone buli,0
UgwcvzRLmigF9m77c4N4AaABAg,worst song ever,0
UgyzCgTJuMtAsDmJdr14AaABAg,guitar onli got string tho,0
UgydaLDbuKYnYuq1KzF4AaABAg,bad,0
UgzepXWarxibTiWuND14AaABAg,came drop of felow dislik,0
UgzEuiNZU2_qN37DsIJ4AaABAg,fel bad al girl simp man back day,0
UgzMm6CW8xGpadXd6w54AaABAg,know song trash we gona talk about fact if hapen modern day would get cale simp like ofer her wear sweatshirt no one ask thought would mention it,0
UgzAnNI9-n1WEMBe4Mp4AaABAg,cring,0
UgxfR_V_QENuwfBmVLR4AaABAg,wtf garbag,0
UgyiVE7DAiTEx_mrEBp4AaABAg,idk song generali scare fuck outa,0
Ugzl0g4RlsyHj9Y-VHd4AaABAg,forgot how bad,0
UgzEIV9vUETOUmslF6Z4AaABAg,cant believ there actuali pl listen this laugh,0
UgxvmXPQLxqz7FQt9aN4AaABAg,nob,0
UgwR_UUJQDR_vN-v0gt4AaABAg,suck,0
UgwZ7o_7J1vnzq41fLN4AaABAg,sili jacob it not shes not readi kis she not want one,0
UgwPJsH7KP0L5P050MB4AaABAg,al these kid video went through traumat experi hope they heal,0
Ugy_WjmyS5mVt0VlYAt4AaABAg,bart baker version beter then shit,0
UgyM-L_MKNpIj5K0CWh4AaABAg,song suck,0
UgxVN9BCotv9LQMU2Ot4AaABAg,anyon cuz sht suck,0
UgznSQrat3yU2ZSIl_N4AaABAg,song disgrac music,0
Ugx1bKb-J28AAW-2cCh4AaABAg,fuck bad shut fuck up,0
UgwPIVIMO0qGhJokP1t4AaABAg,crazi crazi crazi crazi jacop wtf crazi crazi wta jacop,0
UgzkKnD3Jn5GeucK4VB4AaABAg,suck bigtim,0
UgzjNCgRM4voAWt1Uyl4AaABAg,wana strangl him,0
UgwFk7gycfElzhTZGWt4AaABAg,video worth dislik,0
UgyRuDlwS9HCRIZH9CN4AaABAg,come check dislik,0
UgxdxRgZTI9USwL7xrt4AaABAg,disgrac,0
UgzDTG9cCUDa9_vvn_t4AaABAg,yep stil trash,0
UgzQ4eF3Gu2D-Xt7uqR4AaABAg,hate,0
UgzRlbKdf-ylQ7kPN254AaABAg,trash trash trash trash trash trash trash,0
UgyQzsokmsGMx1BoPwN4AaABAg,song make comit suicid,0
Ugy483LD4NznXpMpGLx4AaABAg,stupid song,0
Ugyqlsi53G1gWpf8Ti54AaABAg,lokin like dobi from hari poter guy from hobit though,0
UgwmlUHxMtRsPQhJ3r14AaABAg,not love how there time more dislik like,0
Ugx2zwnj_qzuq6mWh7x4AaABAg,am stil here,0
Ugy8M9rqbo4vamvfLsR4AaABAg,did have se video song make ear bled honest,0
Ugz33IEBMHESOMQg3XJ4AaABAg,song so bad even if auto tune ment help peopl sure not help you,0
UgyvqGHXl9TjB0MLqtR4AaABAg,song made cring asf,0
UgztfMKoNJeMaljkmph4AaABAg,not watch worst music video ever again,0
UgxxoFQUNF2DHy4-Nrl4AaABAg,song so cring stupid dislik,0
UgwuHLdIFfi3zEMbZWV4AaABAg,came back make fun movi,0
Ugz7MgkH4eT-Fq2KMit4AaABAg,can someon explain how get halfway decent roten tomato rate,0
UgyNrTj6FRNtA86zh4Z4AaABAg,sound like joke,0
UgxjeSv7ySfiOj5Eg_54AaABAg,stupid feminist crap,0
Ugw5v0TbksPAAMP2sQ54AaABAg,shes fat,0
UgznzT4u2f-eE_iBJEd4AaABAg,lolthi one even wors than first trailer,0
UgzKCT64LHW5nLj_HpV4AaABAg,worst movi ever also femin cancer,0
UgxcgSpapcfNpBqCYsF4AaABAg,lok bad woman race joke made instant decid not watch it,0
UgyIUpafVCJWSrIJvLh4AaABAg,ghostbust deserv flop rick morani smart enough say no film,0
Ugxx7TQu43HIrIySCid4AaABAg,crowd surf joke couldv work sem unfuni,0
UgzXFtslP9rYqw-FSm54AaABAg,movi bad pixel actuali beter efort than this,0
UghYUnWrrpw0cHgCoAEC,guy bich sucker,0
UgiIKFSQ2-RaangCoAEC,they tri ruin ghostbust,0
Ugg85f_oyTGljXgCoAEC,movi shit theyv ruin ghostbust rip ghostbust probabl star war,0
UghlUEbMT2kRcngCoAEC,what teribl movi,0
Ugg-8Dx06LGsmngCoAEC,have those actor kile movi,0
UgiiPSVhOqpR93gCoAEC,soni think were al feminist bitch worst movi ever,0
UgjkNi4qeXwJbngCoAEC,what god aw movi not watch,0
UggSxI0pgDNoh3gCoAEC,what bulshit movi,0
Ugg2CL0seatrw3gCoAEC,pain movi watch,0
Uggz8Ig2RUpaQ3gCoAEC,she insult crowd rude then pise of when they not want cari her claim racism garbag,0
Ugj_m9LlAz6MOHgCoAEC,think trailer gave cancer,0
UgiM0TxIcOelK3gCoAEC,movi bore,0
Ugg595JoXpJjqXgCoAEC,movi suck melisa fat cow,0
UggncYv68YCThXgCoAEC,what next lame remak anim hous stare rosi odonel rosan,0
Ugh6NrZGdvXNA3gCoAEC,how supris movi teribl,0
Ughot2InrXR1m3gCoAEC,fak,0
UgiNwf7kD7di2XgCoAEC,shit film,0
UggrpU-w-xx62HgCoAEC,watch min at edward oc got refund pos film,0
UghP6r9qA2-oV3gCoAEC,they tri way to hard make movi funi mix with cast choic make everyth about movi awkward,0
UggqbBW7Bu6MKngCoAEC,what disapoint movi so bad,0
UgipnSCjyWKTaHgCoAEC,it hapen again poison us again with feminist materi go hel holywod,0
Ugh3Ftc0yWRypHgCoAEC,shiet wors movi ever like dragon bal evolut,0
UghYOW4CyT3Qb3gCoAEC,it shit im sure most it ben done befor oh wait has rip of not watch last minut bore,0
UggsGOc7x5vkgngCoAEC,shitbust,0
Ughhw35_yK_X9ngCoAEC,shit,0
UgiD2seTUOEqF3gCoAEC,transvestit black guy movi cant act along with rest lesbo,0
UgjQHiTDXKi_cXgCoAEC,femin propaganda,0
UghdORdr04CJaHgCoAEC,disgust fat pig,0
UgglXod3oSbPEHgCoAEC,how comedi die,0
UgjiXW9xs9bX1ngCoAEC,garbag,0
Ugie3UIjKc_m-XgCoAEC,movi suck,0
UggDfKK4FNUcungCoAEC,did anyon els cring while watch trailer,0
Ugh_tI3eoVFZBXgCoAEC,film worst thing sinc kyle jener,0
Ugy_QEat7BEx0C_jShN4AaABAg,aywah milion dislik thes game disgust,0
UgwE6ZuATa4BI1MaZOx4AaABAg,lok dislik smile laugh laugh,0
UgyOyE5zXIsN0pc8ecp4AaABAg,,0
UgzdZ_5iEzqQ28Jydpx4AaABAg,gue it worst,0
Ugy0cPaOtzog2DV8u5l4AaABAg,k like m dislik sound about right,0
UgzMhxng_vKISUFtuVZ4AaABAg,here dislik video,0
Ugy6CIextz9AnMLhIOF4AaABAg,game stil trash not care,0
UgwUQXO1jqLzT56Timd4AaABAg,bad angri,0
UgzGQ6QTvUm0CHZ4iLh4AaABAg,stil stand by decis dislik game,0
UgyBSlPI923G_kxGDBh4AaABAg,game trash,0
UgxWnhvgvjdqxF1B3aF4AaABAg,bad sad,0
UgxdEXpdh14Iw2GXJl54AaABAg,like get more dislik than like,0
UgzdGB2W80RkAfWfWFd4AaABAg,stil it age restrict angri,0
UgzAW6hpGIVoqZKzX6N4AaABAg,advanc infinit warfar were trash imo,0
UgzPxtlBTSK2D_Z7NKN4AaABAg,it fact can fli reali put of,0
UgznChhQQnvRAeP4fTJ4AaABAg,that halo guardian have put dislik not option v,0
UgxvU8TAQfi05RsrL5Z4AaABAg,nah game horibl absolut atroci,0
