comment_id,body,rating
Ugxjby_jzfIkn-GN3eh4AaABAg,that intro with al people was comedy gold laugh,1
UgxTvWrY7h4DG0ybTEF4AaABAg,liza am big fan loved your vid make me laugh every your vid that why like smile laugh,1
Ugxe72MvP6LLsKFdNel4AaABAg,sory does anyone fel unwelcome my favorite part smile,1
UgwRlPF0YobR9qZGH4l4AaABAg,why are so funy,1
UgyyVpoG4yt3xuMpukt4AaABAg,after years had come back childhod,1
UgzZFPGxoQhS8IFiLYB4AaABAg,reported because said bad word laugh,0
Ugz5cTzGfvxnbyFIAUZ4AaABAg,love coming back ,1
UgxaQIqf5fa6zgCR95d4AaABAg,when he threw ice at him at end laugh laugh,1
Ugzplj8058dl3JpfUm54AaABAg,they weird as,0
Ugwe0_3uqQ2ntKZMQCl4AaABAg,even real not sem like,0
UgxDqwf_SHwN7CAT5JV4AaABAg,best era youtube,1
UgyLOp16X68SeYo2xcJ4AaABAg,,1
UgxCzBYSpWT97fn9sPZ4AaABAg,back when wolfie was god,1
Ugx6QOa5b3TlhO1Knm54AaABAg,damn mis these days glad wolfie doing these again but stil mis these days,1
Ugwg4D7OmptrBtGZkcp4AaABAg,not believe he was only seventen,1
Ugz3gZky7I80LLu2_Sl4AaABAg,cringe music,0
UgyToKoOA7so7TM2a2J4AaABAg,us during quarantine seing him waste water ,0
Ugxin7rdDxNOxBHbLJx4AaABAg,wolfe david are one best youtubers out there,1
UgzVm_FHnX53HQaSJw94AaABAg,dude funy,1
UgwtwNLyEUROJ2n2xsJ4AaABAg,yo whats fuck,0
Ugyxb-myftqNFtNTZP94AaABAg,those were golden days sigh,1
UgwVPHu8QYVHJlrX8Wl4AaABAg,top videos give like,1
UgwWE78d4D2cnB-OcM94AaABAg,he lok like nba mvp,1
Ugy_x2Y1cxkzrQ_6vq94AaABAg,mis,1
Ugwbb27UXWH2zQmECdd4AaABAg,how trick again sad my water does al time bad,0
Ugxvuum5_7qaOhA31GJ4AaABAg,alcohol cant freze dumbas,0
UgyXlb7pziYsgiHv06J4AaABAg,dude youre to hyper your stupidsmh calm down,0
Ugyt1-xpjUjrLzEgMC94AaABAg,selena so prety smile,1
Ugzr37P5pG_akdIFVXd4AaABAg,best video,1
Ugzy5hYEZ-zkipw25Sx4AaABAg,ilove selena,1
UgzhyaeQrBoIN8faJIN4AaABAg, best part,1
UgwNs74YhgS48JCCu4B4AaABAg,she so down earth,1
UgwlTYPpYqc-Doke5Vh4AaABAg,she cant sing,0
UgyFDQ15OPNZlsjm2EF4AaABAg,like her fingers,1
Ugz_D_drkMUdYDr516R4AaABAg,now thats girlfriend id likeselena but not that popular or rich,1
Ugx_EbCKgSDzqKaiGxp4AaABAg,love ginger to love benefits selena gomez,1
Ugw1-37ODjK0wt-gja94AaABAg,most viewed video on carpol karaoke history selenas impact,1
UgyULUKC6FsJGFbLu3F4AaABAg,james lowkey sings prety wel,1
UgwSQmzpG3M0en13pBR4AaABAg,quen,1
Ugz7DCRcXKO1CQS34Lt4AaABAg,such col girl,1
Ugxtz2U6a76yPk6jz594AaABAg,shes such an angel,1
Ugy7IWHXMVGfqu2M01p4AaABAg,james an amazing singer just to god,1
UgwAMFbD0Wy-IoS60QJ4AaABAg,her music kinda sucks,0
UgwwWLjephIih2SyFR94AaABAg,love how selena just was so calm on rolercoaster,1
UgxQeq9PXbwlbwg2mVp4AaABAg,shes so real tho shes not extra or anything can se on her clothes xd what would wear on tuesday,1
UgxU_SD9TMttcgdOJ5N4AaABAg,your show be set,1
Ugzbo7Da0nGU3xwD7RF4AaABAg,no one gona talk about  thats how know she can sing,1
Ugw-nz3lAe2EnQH-YOV4AaABAg, was very funy james said am also here,1
UgyTSh7nXCzfpoeMfEV4AaABAg,she so cute,1
UgztC2aVhzwAiE3FM6J4AaABAg,she such vibe,1
Ugy3Ul205Y_-_Oa-Wol4AaABAg,best video ever,1
UgwDCCDJodw4BcPoBjd4AaABAg,laugh like song,1
UgzC-J10HsAkuSRd0_V4AaABAg,gez laughed whole video love selena wish cud met u,1
Ugz_GdMHr_qUYhm7DRJ4AaABAg,also love drink ginger shotslove smile,1
Ugyb9C5TIOyO0ApQ9xF4AaABAg,oh god she canot sing she neds stop making music,0
UgynEc4H5ZWlMGLp-Yx4AaABAg,probably why justin bieber liked her she fun,1
UgzcDwX0Ms2kvQ7NLet4AaABAg,who stil watching carpol again again coz its so god smile give like if are watching in  also laugh,1
UgzqziT9CpyGmgbMIy54AaABAg,she sems so awesome love d,1
Ugwp6HO6yKpVo1y2yVt4AaABAg,love selena smile,1
UgzkDK0TpRN7KAVzLO14AaABAg,audience sounds so fake,0
UgwJmtamJJ_MrlnYh6l4AaABAg,bring selena back was hilarious laugh,1
Ugwx16VCzK59PwIzCY54AaABAg,im in love with her hands she quen,1
UgwAgJht20fxnNhnLGZ4AaABAg,shes amazing d,1
UgwKQDW0uK-dt5p9ukN4AaABAg,selena so prety by way am girl,1
UgyI35O78mNFkNZvmEB4AaABAg,she so lovely beautiful perfectly,1
UgxbpNWwI1DnDJht2ht4AaABAg,i think industry could use litle female sexism girl yes,1
UgxWcjQflFPTMRKoW914AaABAg,selena so cute at roler coaster,1
UgwZ8jp6T0NBwlIDust4AaABAg,my favourite carpol karaoke smile,1
UgzezQlfWyekSd3EU5J4AaABAg,realy love selena,1
UgxnGrLCBxy_5WlFOYJ4AaABAg,who wants part ,1
UgxHhAixcu4NPY5ffTR4AaABAg,take that back,0
UgyFsr9EzaSLHG6E_5l4AaABAg,omg started claping unconsciously,1
UgzYWV79vOTQfA5J1Zl4AaABAg,james realy cute tho love,1
UgxC5mlVV00UoMp4HYN4AaABAg,selena gomez so fucking col love how col was singing on roler coaster,1
Ugw2sy1b1xfyWdmuJIt4AaABAg,shes so beautiful amazing love selena gomez your best,1
UgwuYj-w26ZBaPtKEkN4AaABAg,my favourite introwhats up bros my name pewdiepie,1
UgzLwrbF_ahivp3HRcB4AaABAg,stil relevant laugh,1
Ugx8V2lOJUVEzGbqCFt4AaABAg,like this congratulations,1
Ugy4o8_tG5M3jw01Ff94AaABAg,fel so sad for,0
UgxZ-RNSth_ggyxIqM94AaABAg,love edgy pewds,1
UgwKyds9ECkIEbXTlq94AaABAg,he lok like viking god,1
UgxdXN_2K4uRbnJfOst4AaABAg,just randomly thought about for first time in four years video freaking hysterical,1
Ugx5eDkE-idXsl2igPh4AaABAg,col video,1
Ugwqv_ivqpAA3_F6RJx4AaABAg,man legit,1
UgxrNH7-Uk_R2dphq3N4AaABAg,col,1
UgyCIBop1TuRI9PqUKd4AaABAg,watching vid with m subs,1
Ugz9M-thnYkP8zRbQ3t4AaABAg,,1
UgzpIBz8MJfXu19c-914AaABAg,very nice god,1
UgydD-f1E05qB3LdYXx4AaABAg,got my paper play buton yay ar at ,1
Ugz039M63xmPQ80L9_x4AaABAg,fuck,0
UgytuSxwMb4amZ-s1h14AaABAg,get diamond  pewdie awesome video,1
UgySIS_cxX8VfZAcsaR4AaABAg,damn mis era pewds pewds from late  first half  was something else,1
UgwtWhBsUhYvhlGp9wh4AaABAg,subscribe me ,1
UgxukHCVrsDEM4jY6cR4AaABAg,god,1
UgwS6jR3Bze1mH1416t4AaABAg,but at least thank you sad im hapy for but might mark yourself respond or put hearts coments,0
Ugwuv8eNZpWFZxGEM214AaABAg,stop saying bad words like seriosly,0
UgxEnBQX3DogIwEWKWt4AaABAg,fuck,0
Ugw--RO3KxxQfpaXEyF4AaABAg, funy,1
Ugwgevc-zK_wVze31QF4AaABAg,gives me chils every time,1
Ugw0CMgO1zFfsRFqXpB4AaABAg,probably best game trailers ive sen,1
UgwOhuzOsyYDMxCgbIV4AaABAg,whos watching  smile gota love trailer,1
UgyVSPRbLvCHHIZIaRp4AaABAg,here in  stil as beautiful as first time watched,1
Ugw1IDrVIPLmiIbrbth4AaABAg,cant wait,1
UgzNKsp2y2wkQ0DqGJp4AaABAg, im stil shok at masterpiece trailer,1
Ugz7mTnOx9Jj3Tdb88J4AaABAg,best video game trailer ever made,1
UgyfB4MBe65yB3CSX0R4AaABAg,was best youtube ad ever,1
UgzxdO4IxBO806OsB814AaABAg,greatest fp shoter game ever,1
UgyDGLzkx-QCD0iEIkB4AaABAg,stil one best trailers ever made,1
UgzVn2VnaoA3NzgPCEp4AaABAg,best trailer in unirverse,1
UgyFflT4ZjygFV1F-Jd4AaABAg,there wil never be another game like honestly sadens me,1
Ugzh36YYOxWZxbnqxJJ4AaABAg,love game,1
UgxXduxa-IXIGQJQHNB4AaABAg,who also comes back get gosebumps from this,1
UgzAc56dsO6R-Yv_tV14AaABAg, oh realy like scene,1
Ugy-G4MKizFCdptJqdt4AaABAg, years later stil loks awesome,1
UgxfCoE6Yknwg1WyR714AaABAg,best trailer ever made even after almost  years,1
Ugw-9WcYvrXMNz1m19R4AaABAg,only god bf games deserved trailer god,1
UgyrMAFunBJqV-8T1NR4AaABAg,was released on my birthday best birthday present ever,1
UgxwMOqKb-0vxwkWrmN4AaABAg,kep coming back just love so much,1
UgzQXPo2GvruwxVWkVl4AaABAg,am almost certain that song makes every trailer beter,1
UgwDIX7MVOFBA1HcrJR4AaABAg,best game trailer ever,1
UgwyOyvXJxgcUI7DmcV4AaABAg,love al batlefield games,1
UgyoamBpoRhcy-3Is4N4AaABAg,when batlefield was beter than cod,1
UgxZRHTvSU60JNidoOp4AaABAg,if only game was made for next gen consoles man would have ben best loking game ever,1
UgxJuwK6scvkSLsLvNR4AaABAg,stil get uncontrolable chils while watching this damn,1
Ugy0BHKTvif2BV7qFP14AaABAg,batlefield  has best graphics,1
UgydpgpKQmadCN2O1V94AaABAg,best game have ever played ever wil play,1
UgwSTYpKice5iy9EQFl4AaABAg,god stil amazing,1
UgwEsUtSx3wdlcKaobt4AaABAg,everything about game so god in my opinion stil play after  years,1
Ugw01PCBEIdDxLJnnfp4AaABAg,know did something phenomenal when your trailer has  milion likes,1
UgzuOQoVtjD2qjNv32t4AaABAg,ah beter,1
UgzWv4dliv4yHcxrTNN4AaABAg,what masterpiece,1
UgyuREjBaf3ieB0y4z94AaABAg,stil greatest batlefield ever,1
Ugw2fwh9eYxDxlyRPbR4AaABAg,best reveal trailer ever saw,1
UgzUm9eVVpLF6YrC8Jl4AaABAg,legendary song for legendary game,1
Ugxh563dlcxJW-HrmHl4AaABAg,they chose best music ever,1
Ugxgu6byfVRFVXbu90h4AaABAg,pres f for batlefield,0
UgynbM014wdguiMLUTJ4AaABAg,never gets old,1
Ugxc_pQW9HGc2xB4zg94AaABAg,batlefield one kind,1
UgwCBqsv8JzcLggswjF4AaABAg, best trailers made in video game history,1
UgwNiCnMsVOEVB7upUp4AaABAg,crazy how  years old game lok beter than most games nowadays,1
UgwEjL5TCeRUlHTPz5N4AaABAg,batlefield  last god batlefield game before franchise died as long time bf fan breaks my heart how did end like this,1
UgxIur01EIdPiv2wDrZ4AaABAg,was way to short,0
Ugw9NMJsc7p-KVNdLDV4AaABAg,without doubt best batlefield,1
UgwKNBi7JQmq7nh1CX94AaABAg,the best trailer ever,1
UgyuOsjTmLu2MvZS-Yt4AaABAg,stil best trailer,1
UgxkE00vgsDcC7Uk6Cx4AaABAg,im not sure il ever be as excited for game as this trailer blew my mind when came out stil does today,1
UgxHsIoVQWgmnT_7ABd4AaABAg,what master piece,1
Ugx285ccnwLs_bRJE_54AaABAg,game was so much fun so many things do never got old,1
UgwAItn_jZ2Yyz1EjiZ4AaABAg,even  wil end game stil best ever   ,1
UgwE6FG5si53yQ_kGYV4AaABAg,best music,1
UgwgdGWDOKO5fGDUMRl4AaABAg,best trailer in gaming history thank ea dice we ned new batlefield destroy those fps games out there,1
UgynQsU36897SN4psuF4AaABAg,one best games ive ever played in generation,1
Ugy01TugZyARlmnEoKx4AaABAg,ima tel my grandkids game was only one we had,1
UgzUytN_KtAJsWnUW714AaABAg,best best,1
UgxG6F82eEqN05YJNY14AaABAg,best game ever,1
UgwD6a56B03DK0Imfat4AaABAg,best modren game trailer ever,1
Ugx7AjvtHHrBrnO0itF4AaABAg,mis  man,1
UgwKWCd_p5ARkEvQ7yB4AaABAg,best batlefield in my opinion,1
UgzVW3PsNRqGcQ251At4AaABAg,youd think trailer litle exagerated but game played exactly like it one bigest wins in recent gaming,1
UgyyZHlx1cQ78PIG9794AaABAg,was one ogs like rolex,1
UgycQLaFVxgFmaRf7gl4AaABAg,trailer gave me chils ea can do right,1
UgyioYviIfUiPu1Ry8J4AaABAg,epic trailer epic game black ops  sucks,1
UgzhXwn8JHG_-K6hl6N4AaABAg,song never get bored,1
UgzrhnytGWBDaZH21Zl4AaABAg,trailer so motherfuckin awesome,1
UgzBc1Cq50bWxqcG8rd4AaABAg,who came here for relief,1
UgzjH8MZ0W_06zkrnY14AaABAg,like panda bob marley smile laugh,1
UgzNe9oYl4csgX5dJtF4AaABAg,no substitute song,1
Ugxz7zdH1PpyyTDhSvx4AaABAg,lets se how many legends are watching in february ,1
UgwXhvCEd8JjruuIzpF4AaABAg,like,1
Ugys45mLy9ZTyCwOk694AaABAg,smile god,1
Ugxcr27ezMh85QKTfdl4AaABAg,amir liaqat version much beter laugh,0
UgxdhrYKY8MhMfRaOKJ4AaABAg,nice,1
UgynzajYGQSvCwjScLd4AaABAg,like,1
Ugy4kCwgDLI3m6YL0Ht4AaABAg,earphones plus ful volume legends smile,1
UgyrfBwfUmgVwC0h0R54AaABAg,god surprised,1
Ugz1mC3l7iFlQ1NJpCV4AaABAg,god,1
UgyTXaJkHfdJs2pIp_Z4AaABAg,smile laugh,1
UgyyGnNUpZLQJox1yWV4AaABAg,m views weldone god,1
UgzsJlazBKVWfsFgsCZ4AaABAg,very nice omg,1
UgxYLFHuIcSdDUbrlRR4AaABAg,want when enter my clasrom,1
Ugx3QLq9IVpWJIOrmNV4AaABAg,lets make trending laugh,1
UgzZFU9-TtXpSDuWklV4AaABAg,panda are cutest songs cover to,1
Ugw8u7nD__GqUlPFBj54AaABAg,best beats in world,1
Ugwrt9Zb3-ig9O9zg254AaABAg,,1
UgzPuWnsq8SmdZ1FJOB4AaABAg,very top bro,1
UgyU6A-tBnV4qcb7nw54AaABAg,songs get my hype asf man,1
UgwokHIgd73ihLLHWlR4AaABAg,wtf he saying laugh laugh,0
Ugw0BUGScAWdBeMpwQF4AaABAg,like d,1
Ugzc6yBtMGZNWpTpZb54AaABAg,love song smile love,1
UgxFoTijj59y3cUm6jp4AaABAg,god god god nice,1
Ugxsjuv68tfXkCI01EJ4AaABAg,bra idol like song bra,1
UgwXuOkKAxtmB-2MAF14AaABAg,love panda,1
Ugz-ZBwTroVbkG9slh94AaABAg,laugh  god music,1
UgxV7UiZgp5I0NFp-v94AaABAg,lit god,1
UgztUxi5inIaIjWRT-F4AaABAg,love song stil in ,1
Ugy-Z0YYi8lIOrmA5GZ4AaABAg,super hit song,1
Ugz9PgePkGqG-IE02yx4AaABAg,,1
Ugzj2upWeo6qz8SxVW54AaABAg,ultra legendare watching in ,1
UgwJeIqn9K3oXiw2ORx4AaABAg,love these videos m likes,1
Ugxp-Q6kLzUADI6bi0l4AaABAg,who else kep watching these videos,1
Ugzaa3XHR4Rp0CZlmGl4AaABAg,we did  mil,1
Ugyg3wmo6zzv35dM0y94AaABAg,make me hapy eva,1
Ugx4SKVw2nTzgIWvuTR4AaABAg,what youre wearing part not true when was younger just qore whatever was in my closet,0
UgyGiMUJYbVIrJIYyBl4AaABAg,omg got m likes go eva,1
UgwF_811CcfmcsBT4NF4AaABAg,i love your vidyos,1
UgxUCO_ySKTKkww_tMx4AaABAg,laugh smile laugh smile smile laugh laugh,1
UgyzPBH27hRHGDhdsrB4AaABAg,subscribed your chanle,1
Ugx30pBHbmWTOIyHzSt4AaABAg,love you pls give me sout out,1
UgzCRSt2shOhp2TRo6l4AaABAg,love that song in begin,1
Ugzt42r37y_zPPUKpU14AaABAg,love,1
UgxjAU5eVr386Y4QqpJ4AaABAg,make col viod,1
UgzAdFNC-w0WlBifEzx4AaABAg,love your youtube chanie,1
Ugzit9s0p8xxBlaHld54AaABAg,are my favorite youtuber eva,1
UgzvsOxRfHpSXKrJd7F4AaABAg,love it,1
Ugzk_7J_4GJTHMGLaQd4AaABAg,are so funy,1
Ugw9xXUZncmz6Mqx4wl4AaABAg,wow she so famus,1
UgzawVFgw62kJOTb6TV4AaABAg,does anyone mis these kind videos when everybody did colabs together,1
Ugxd4H0BOWlnL47uwRV4AaABAg, anyone like for,1
UgyqARpwOrfAsOGroWt4AaABAg,yay its at  milion likes,1
UgzDAD10wYcXnpT-oqZ4AaABAg,  mil,1
UgwmrHJlHVaIHQumZZZ4AaABAg,col,1
UgyMe75g5awosH7PC3x4AaABAg,love so much ave,1
Ugzh2WPJnILzSKaflJt4AaABAg,god job ava got  milion likes god,1
UgzfRegPj3iAMhSwocR4AaABAg,he lok like gonies hey guys,0
UgziW9xBYErHQLuydV14AaABAg,,0
UgzkZpw66Mybhsr3DIJ4AaABAg,stay strong,1
Ugx0hx_oM0j5fHC71ux4AaABAg,not gud,0
UgyznYgwhl7mLA4itv54AaABAg,bulying not real your kid geting roasted shut up teach him roast,0
Ugz59Pi38yUAd86iJ6l4AaABAg,bad that lil nga next,0
UgxaaIbpBGoh9dQoBG94AaABAg,kep your head up budy,1
UgyXnf_E01UGOG2PqvR4AaABAg,ridiculous,0
Ugxq9IStBMgY8TUGtA54AaABAg,turns out mom racist as wel laugh laugh,0
UgzmkiBfTcJtwFhuAAB4AaABAg,fake asf faking reactions,0
UgxnQeaRn4t1SdvrkOp4AaABAg,racist money hungry people,0
UgyRrepp39XrQsRBoVl4AaABAg,what loser,0
UgyTF5vafPdSa-9-hyV4AaABAg,what scan,0
UgzIzahk51dN6tU14bZ4AaABAg,hop that lady knows they racist af,0
Ugw8IaIcXxRwyiX_Jtx4AaABAg,york parents racist so yo get what deserve,0
UgwQARi6rNSU2SnxWT14AaABAg,was ironic bad,0
UgyQv5Dj1ycXD961VKZ4AaABAg,what people fel sory for world trash,0
Ugyasy1JCWZTMWt9A054AaABAg,his mom racist as fok she cant even lie,0
UgzyFR46BhwHaSFm2ex4AaABAg,fake he was caling black kid n word,0
Ugy5sZXm0ETfPfIsE9R4AaABAg,fake know him he was bulying other people,0
UgwZ9SIn5Za7U5q_foV4AaABAg,wish he was my friend not like how he gets bulied kid sems like nicest person on earth smile,1
UgxWefvgmMTiEtLTS994AaABAg,ive ben bulied way worse but not have k in my pocket,0
UgzEeyNjCd9QwQgsXDZ4AaABAg,so basicaly he was racist thats why he was bulied,0
UgxtJTB0G1_6xP1v8kV4AaABAg,orange man bad nice job fake news network d,0
UgwaSh8lKmSjqiMm_2t4AaABAg,cn msnbc al fake news know im not even from america laugh fake asf,0
UgzPti_vfPJgwfBOsfR4AaABAg,cn dumbases bos are for you,0
UgwPYWb2xs8kg90IGqt4AaABAg,crowd bos sound more like two people,0
UgzgNhXZjxmom2Ue8Bh4AaABAg,cn fake news milion subs for cabal owned globalist corp turning out lies,0
Ugw1T07ogklpx3l60-94AaABAg, years later cn just keps proving trump corect cn worse than fake pure propaganda delivered by trash humans,0
UgzKnSHg_cwlizcRJEt4AaABAg,love president,1
UgxXfnUJSIDchvOI5Sp4AaABAg,are fake that not crowd boing was cn crew,0
UgxY17GhwkGeH8lCw-h4AaABAg,lokie here cn posting some more their garbage paying youtube make sure garbage shows up on my fed,0
UgyX6LY46tIvwKdEr-94AaABAg,yeah those arent bos laugh tel me another one cn,0
Ugzs2nHWIB6W8Vv4kdN4AaABAg,donald trump was right cn very fake news,0
Ugxd8zTljb7RWkTa0Sx4AaABAg,ashole network,0
UgxjpMQ-nQU7quYgMwV4AaABAg,clinton news network back at again with fake news,0
UgxuW3f7Dm2opKh_0I54AaABAg,laugh stretch cn,0
UgwYQEU4YgnDAn910pV4AaABAg,clown news network what bufons at clown news network have falen to are owned by president on daily basis why not quit while your behind way behind reruns simpsons beat in ratings your contemporaries laugh at you we al laugh at you fuck fake news clown news network,0
Ugx980i1Bh_vGuJeShV4AaABAg,so fake had flag as misleading text,0
Ugyah108nUT5S4Bi1j14AaABAg,oh cn yet another fake video where make up what hapened,0
UgzoWRmzmMPTylYIQft4AaABAg,just do quick research on web youl se how fake cn,0
UgzYknKrl-xb1jQpcdB4AaABAg,cnused likewatch al time nowi only find your news posts type smhcn are disgraceful,0
Ugz5q35VHt9yPqWJxCd4AaABAg,fake news just that we se through especialy cn,0
UgwiLc3IztxvqZGB7b14AaABAg,were boing cn youre so fucking stupid not even tel laughh,0
UgzXbqwuNN0U9ntowMJ4AaABAg,cn wil never shed their fake news label if they kep doing stuf like this,0
UgyulLf66YSoSkHEV4F4AaABAg,cn fake news,0
UgzwX8aXwoAHO7IYXv14AaABAg,they claped even your youtube chanel fake trash,0
UgwqrXuGy0i28Odya7Z4AaABAg,they boed because he said cameras would go of cn dumb,0
Ugw3nM_qJApP3kspoCN4AaABAg,fucking click bait turdcn,0
UgxBgydMhWfrAKv2jDd4AaABAg,heard faint groan fake news,0
UgzzEZaa0-LCa7VLwWt4AaABAg,lok man hate trump but nobody there was boing him cn dumb as shit,0
UgzMOjCJEy6xrXqN30B4AaABAg,theres no boing theres only laughter claping,0
UgxmhzB72sRK6cqbrXJ4AaABAg,should be piece shit trump,0
UgyOIVU2fqJQXj--0st4AaABAg,laugh cn eat dick fake news,0
Ugxr7KcmznuK4gE2GbF4AaABAg,wel fakei mean vid not trump,0
UgyOKYowYElNi2EBPKp4AaABAg,wow like  people boed do not like trump but cn neds chil,0
UgyvBQkKvm1MkGo_1UJ4AaABAg,wish donald trump was fake,0
Ugz6wmzfvKm_vakYebB4AaABAg,cn fake news,0
Ugx1X3g5y_-hvB9G6ON4AaABAg,laugh how stupid can cn get obv not bo laugh fake as fucking news liberal scum,0
UgzNQfnCX_uAQLXfIup4AaABAg,what bos ya fuckin pricks lmao,0
UgwfXGxxg4ovJtcQW1J4AaABAg,they said o quit spreading lies,0
UgyO9u-exjgX_PsWdWR4AaABAg,fuck trump am right,0
Ugx0s2-FgBFnCjne65J4AaABAg,go bed fake news,0
UgzBYTo1ychqyZmhhoN4AaABAg,sigh its like their trying prove that theyre fake,0
UgxnVc6sSBQPVDfbie54AaABAg,cn kil yourselves,0
UgxhOJuJurVNbcSOiYp4AaABAg,thats because are fake news president go figure mr briliant,0
UgyUDEYlYzthMiP_lwJ4AaABAg,cn fake news so video fake case closed,0
UgwHJImMhvrzRmEtdKl4AaABAg,heard hardly any bos at al,0
UgxzsmslP43SKu-9WB14AaABAg,its funy cause title fake news,0
Ugxo3jhCBi8Ti__ZEaR4AaABAg,that bo heard was meant for shity pres like cn trumps stil puling your strings,0
UgyVA0tMdADZ2VWscmF4AaABAg,cn as,0
UgzK5Upy_7i_KobyWmN4AaABAg,o not bo fake news confirmed again,0
Ugz4TWhz3wJ5_ft1_Al4AaABAg,fuck cn,0
UgyJyHbwcymGJg2ranF4AaABAg,fake news its cn,0
UgyIFsw7y46jqZ-w7Th4AaABAg,that was nothing lol cn fake,0
Ugxzb4VOuuHljhKS2614AaABAg,republicans are worthles cocksuckers ruining america,0
UgwXPLJ7tsqkKVSM4P14AaABAg,imagine having pay for steam,0
Ugy7UPhfWt0CpxyAa054AaABAg,whoever liked this fuck you,0
UgzI0CrsKnap2cOVnZ54AaABAg,wow gredy politics win again,0
UgxogdwADzDNC9XvkRR4AaABAg,fuckers,0
UgxhPWbvrg-oq1HDCO14AaABAg,godbye internet,0
UgzmxkHYisZ6puPXB9h4AaABAg,wel we are fucked with internet now,0
UgyAiRP5UAshRJxa5Nt4AaABAg, when fc made bigest mistake its existence,0
UgxNHCpwooYcIOO35Xp4AaABAg, unelected people chose future internet that  people not want,0
UgzOltObf2S5jOWqslZ4AaABAg,fingers crosed someone from dep web gets ahold guy laugh,0
UgyOmCShkzGPSqRI-xF4AaABAg,wow trump fucked up america again jesus christ,0
UgzI7cixFFiiDK8YsEp4AaABAg,dislikes laugh god,0
Ugy9KShfYunmXc7ves94AaABAg,what america is leting few people vote for something instead leting america democraticaly vote for it,0
UgzUfP5w8ijjgiJt_OZ4AaABAg,typical fucked up america laugh,0
Ugw2wOw4d8om4nCWjUV4AaABAg,fuck fc,0
UgzPoyMZ0NC1liap-BN4AaABAg,amount dislikes speaks for itself we people do not want net neturality be repealed,0
UgxKDVqyJG9TMZJGntt4AaABAg,truly hope they al go fuck themselves now fucking hope they crash their cars lose limb fuck these guys,0
UgwksbCg7imiFLNcHS54AaABAg,fucking bulshit just turned  percent americans into people who want basicaly kil kim jong un beter nuke america bulshit,0
UgwF1RluMcRgC3jvSN94AaABAg,freaking fc,0
Ugzg96n3jc_lL4PFyit4AaABAg,fucking trump his dumb as staf,0
Ugw7u8VpDqkx7NrS4sd4AaABAg,screw ajit,0
UgznW7546wFDz-AecW54AaABAg,no more memes to,0
Ugwrx6U3KP5EjisEqBZ4AaABAg,why cant have more dislikes people,0
UgysZG-0Ae5x81tDO-t4AaABAg,who tf liked video verizon employes or at tryna be slick dumb bitches,0
UgxReGjfHsDkm3jf6814AaABAg,fuck shit fuck,0
UgzV2m-1hF7dgJpP1tx4AaABAg,sincerely hope ajit pai ses this fuck you,0
UgyQxP9aQj8CLi6-Y654AaABAg,thanks for causing great depresion ,0
UgwnZxQny-B5uc3C23Z4AaABAg,fucking comunist,0
Ugxr5QoXD14cspAyUoV4AaABAg,its oficial internet fed,0
Ugw-dO7uDwrCrILQKol4AaABAg,fuck you,0
UgxE7cimY4GRH7jGFJx4AaABAg,fuck ajit pat fuck brendan car fuck michel oriely not how democracy works,0
UgxeU3hmFfMLUR2np214AaABAg,man some bs,0
Ugw2CXDQHgm40A2rkRV4AaABAg,one most corupt move in american history,0
UgwjbuClxuV97HRcf1N4AaABAg,my ears hurts,0
Ugzg9prj3HD88L25FkR4AaABAg,omg sounded as if someone just put distorted efect on her,0
Ugxu0sA_I2tfWEVk8nd4AaABAg,simply beautiful,1
UgyTvzCrP3AAQlUJnEZ4AaABAg,hurts me on so many levels aint even american,0
UgzIZh4Bm2MEDXZHL1h4AaABAg,wowtf,0
UgyOf2cshwRUxzi8MEt4AaABAg,jez that real she ruined it,0
UgyxxPOFwMPmsq5tRh14AaABAg,laugh horible,0
UgxhxTlgADez4jMEaR14AaABAg,they ruined star spangled baner,0
UgzKDpXSWep-14TFde54AaABAg,wtf was directed from whitneys anthem horifying,0
UgziVYOK0crATGMXTV54AaABAg,torture,0
UgxNcGO4GhJaEx-9Rf54AaABAg,what kind shit this mariah please teach fergie how sing,0
Ugy8atzy1rD8Ma9BeTp4AaABAg,beautiful voice,1
Ugx-EZmybfXK0LQeSW54AaABAg,swear just saw selena gomez coment she cant sing,0
UgyKNhSZzwNUd2t0W7N4AaABAg,oh no think my cat just got run over in driveway oh wait never mind that was just video,0
UgytYTmDrnG1oGDprNp4AaABAg,hate when people remix national anthem make sound quer,0
UgwT9RLU6fy-0mWNzRl4AaABAg,wtf this im scared,0
UgxgGwDN8rwVJ0YkEsp4AaABAg,first half was prety fine but al went shit after that,0
Ugxqy_DkUGRSGJgiXEJ4AaABAg,im canadian fel bad,0
Ugx1ki156ZtJj9TBqgp4AaABAg,fergie lets play some basketbal me lets play some auto tune,0
UgziRzAD2SuQmqIIOUx4AaABAg,just as cringey as i play pokémon go everyday song,0
UgwUeytLjZ-CTyUbf6B4AaABAg,was so funy had like it laugh,1
Ugy9Um3gteRDZkqANEZ4AaABAg,backing track for disaster literaly sounds like my morning dump soundtrack ,0
UgxHb34GBM-K1AmUajV4AaABAg,threw up,0
UgzrEG7XTEhE0KfIEdZ4AaABAg,omg bet draymon sing beter than her,0
UgxT8W01UQi92jtjLrt4AaABAg,so hard watch omg im cringing through whole performance,0
UgyCTcEbHD2x9y_k5BR4AaABAg,wowembarasing,0
UgwP7S16Ww7tdigHpCB4AaABAg,shes disgrace our country,0
Ugx-cM7qzjlL-RtEUf54AaABAg,what actual fuck did just watch,0
UgyPTp1l_mvDbkygZwl4AaABAg,thats so bad hurts,0
Ugy60Eog99vYFZSmYsp4AaABAg,she hwing disrespect flag,0
UgyOxwZsm30DlmV6moh4AaABAg,every time time listen think what fuck mosly because she thinks its god,0
UgxFiEAtT1z1DosSQWx4AaABAg,th s c nc e are,0
UgxAGPvfJYkTSg2QBhl4AaABAg,wheres gun when ned ,0
UgwotOTtrk5X2VVVPYp4AaABAg,ned clean my ears now laugh,0
UgxP5NbMOM5iK8kE5El4AaABAg,bad,0
UgyaJx1eN7wr-nu81RJ4AaABAg,she sounds like dying cat laugh,0
UgyP2ThaRmV1kfv9Nup4AaABAg,shes singing like shes in rundown nightclub bo,0
UgyACfo1H2RiohmDXjt4AaABAg,jesus,0
Ugxzf4buH4D-T9mbvix4AaABAg,bitch on meth,0
UgwCW4DeIvLmb2iu53J4AaABAg,ive heard cats fighting that sound beter than this,0
Ugzwm3R3Yoms1TVM6CN4AaABAg,shes like drunk,0
Ugz7a3cZarigYlRrSkd4AaABAg,certainly losened crowd up with laughter,0
UgwLuPjHdI_kgA0tcPt4AaABAg,she cant sing,0
UgyjY1l07GagH3dY1d54AaABAg,ariana grande at  years old sounds beter,0
UgxDNIWcxIGmScLn4jR4AaABAg,what hapened her voice,0
UgyYYybYo72j1PpK6vZ4AaABAg,what that shit,0
Ugwk4tSXwoB-5RT5Ii14AaABAg,she must ben on drug that day,0
Ugy75sN3MNcA6ILM4vF4AaABAg,what in fuck wasthat,0
Ugz5s9h_h1wCdAxPDnp4AaABAg,should do my homework but no im here listening meme songs,0
UgyexmvpnEt883SwYSR4AaABAg,day she said god bye her carer,0
Ugy7rxT4TOLiLHdrx7h4AaABAg,gald your out ofice,0
UgxY2bGxtPlaUx6Awi14AaABAg,stil beter than youtube rewind ,1
UgxkK_8NHv-WHQyIf0x4AaABAg,fuck,0
UgynKo5mbcvZsUVcxUB4AaABAg,even dudes family hates him,0
Ugx6R6XHZBxnGmH1nCR4AaABAg,fuck,0
Ugzxzb_RjCp_Qa3rdCB4AaABAg,hope your stupid reses cup breaks moron,0
Ugz0zm3oe0_vp_xkdHB4AaABAg,what tol,0
UgxN7oWN4fYujp8yQJN4AaABAg,get that inocent dog away from him,0
Ugyfh7uBvzzmuIb4kXp4AaABAg,epitome how do do felow kids,0
UgywXmarzn8QHrmmr0R4AaABAg,when both republicans democrats realize shit was retarded,0
UgzUnFpNwdd8SrOTDSp4AaABAg,why am revisiting sht,0
UgwnvdqO0duOYhFtom94AaABAg,not like fc because video,0
UgycHOu51p6A7T9xfbB4AaABAg,has be one soriest videos on youtube,0
UgxV_h_rYkZzLGwnQtF4AaABAg,jesús christ what mes,0
UgzYyThcr49LlLItTpx4AaABAg,he loks like fucking turd,0
UgyvW-XmhNFl8SJdyMJ4AaABAg,im stil mad about,0
UgzNw3DOk814_ik9NDV4AaABAg,who hel liked,0
UgxOV5lUNL8NsB5QQ2N4AaABAg, sec watched im wiling pay anything if means can punch douchebag,0
UgzKIndRqXalRpHAVSl4AaABAg,ajit pai greatest hero ever he wil save internet haters go away,1
UgynnSbNjLqo3n8H-2p4AaABAg,has be worst video in history videos since maybe ever,0
UgwF_efHLoZQE_PT8Ed4AaABAg,love ajit pai,1
UgwbzPjEOuisaISNz4t4AaABAg,he makes me not want eat at chipotle,0
UgwRiLT40AwxdQT7hxd4AaABAg,pajet po in lo back your third world shiting stret america for americans,0
UgxHPm1Sz-MOx47kWKR4AaABAg,dislike buton gets raped,0
UgxBdm-CuN-4kOL6RzN4AaABAg,so ridiculous cringey,0
UgxENXgmqZ3VusSzKzl4AaABAg,im watching in  only liked because how cringy,0
UgwOOlVVqXjQ4TiJAm54AaABAg,kil me right now,0
UgxbpJ0d34IwtKbPBeZ4AaABAg,hey can we get video milion dislikes please,0
UgyrOddkzaNahzKXEeN4AaABAg,fucker tring hard be funy,0
UgxFTFGyUU0-9K2Q1hl4AaABAg,stop pretending be human ajit,0
Ugx5wsf0e-7EQ8xEqux4AaABAg,legit fucking cried,0
UgyL8j9LOaWGiP6z3qB4AaABAg, at least he agres its realy stupid,0
UgwzMjyECw0Oencp6r14AaABAg,ha get fucking smoked,0
UgxJUazFje6Jx_pXvJp4AaABAg,going rfelowkids,0
Ugx65xSFwKbpRZMzztB4AaABAg,likes are corupt politicians,0
UgxXZM6d-_Zt4bjE-Wp4AaABAg,who like in first place,0
